CREATE TABLE customer(
   Customer_Id  INTEGER  NOT NULL PRIMARY KEY 
  ,First_Name   VARCHAR(15) NOT NULL
  ,Last_Name    VARCHAR(15) NOT NULL
  ,Email_ID     VARCHAR(32) NOT NULL
  ,Phone_Number VARCHAR(12) NOT NULL
  ,State        VARCHAR(19) NOT NULL
  ,Country      VARCHAR(13) NOT NULL
  ,Sign_up_date VARCHAR(11) NOT NULL
);

CREATE TABLE streams (
	Stream_id INT,
	Customer_id INT,
	Content_id INT,
	Stream_date DATE,
	Stream_time VARCHAR(50),
	Stream_duration INT,
	Stream_rating INT
);

CREATE TABLE content(
   content_id      INTEGER  NOT NULL PRIMARY KEY 
  ,title           VARCHAR(90) NOT NULL
  ,episode         INTEGER  NOT NULL
  ,genre           VARCHAR(29) NOT NULL
  ,duration        INTEGER  NOT NULL
  ,cost_per_stream VARCHAR(6) NOT NULL
  ,release_date    VARCHAR(11) NOT NULL
  ,distributor     VARCHAR(36) NOT NULL
);

CREATE TABLE Invoice(
   Invoice_number INTEGER  NOT NULL PRIMARY KEY 
  ,Customer_id    INTEGER  NOT NULL
  ,Sign_up_date           VARCHAR(13) NOT NULL
  ,Plan           VARCHAR(8) NOT NULL
  ,Service_period VARCHAR(25) NOT NULL
  ,Payment_method VARCHAR(15) NOT NULL
  ,Total          VARCHAR(20) NOT NULL
);

INSERT INTO customer(Customer_Id,First_Name,Last_Name,Email_ID,Phone_Number,State,Country,Sign_up_date) VALUES (1,'Freedman','Akroyd','fakroyd0@umich.edu','913-680-9878','Kansas','United States','07-Aug-2010');
INSERT INTO customer(Customer_Id,First_Name,Last_Name,Email_ID,Phone_Number,State,Country,Sign_up_date) VALUES (2,'Nollie','Haibel','nhaibel1@mediafire.com','480-518-4776','Arizona','United States','11-Mar-2009');
INSERT INTO customer(Customer_Id,First_Name,Last_Name,Email_ID,Phone_Number,State,Country,Sign_up_date) VALUES (3,'Pepito','Schlag','pschlag2@shop-pro.jp','602-404-5887','Arizona','United States','07-Feb-2014');
INSERT INTO customer(Customer_Id,First_Name,Last_Name,Email_ID,Phone_Number,State,Country,Sign_up_date) VALUES (4,'Cash','De Banke','cdebanke3@last.fm','937-223-5664','Ohio','United States','05-Nov-2017');
INSERT INTO customer(Customer_Id,First_Name,Last_Name,Email_ID,Phone_Number,State,Country,Sign_up_date) VALUES (5,'Gale','Hawker','ghawker4@lulu.com','571-914-8911','Virginia','United States','25-Jun-2007');
INSERT INTO customer(Customer_Id,First_Name,Last_Name,Email_ID,Phone_Number,State,Country,Sign_up_date) VALUES (6,'Adriaens','Klosges','aklosges5@surveymonkey.com','727-268-1299','Florida','United States','05-Aug-2017');
INSERT INTO customer(Customer_Id,First_Name,Last_Name,Email_ID,Phone_Number,State,Country,Sign_up_date) VALUES (7,'Patrizia','Haslehurst','phaslehurst6@auda.org.au','126-676-8457','Berlin','Germany','15-Jul-2019');
INSERT INTO customer(Customer_Id,First_Name,Last_Name,Email_ID,Phone_Number,State,Country,Sign_up_date) VALUES (8,'Nikki','Clifton','nclifton7@mozilla.org','549-306-6130','Nordrhein-Westfalen','Germany','26-Jun-2019');
INSERT INTO customer(Customer_Id,First_Name,Last_Name,Email_ID,Phone_Number,State,Country,Sign_up_date) VALUES (9,'Ryun','Govier','rgovier8@squarespace.com','727-548-3002','Florida','United States','19-Dec-2000');
INSERT INTO customer(Customer_Id,First_Name,Last_Name,Email_ID,Phone_Number,State,Country,Sign_up_date) VALUES (10,'Gwenny','Macguire','gmacguire9@lulu.com','135-737-2506','Berlin','Germany','07-Nov-2006');
INSERT INTO customer(Customer_Id,First_Name,Last_Name,Email_ID,Phone_Number,State,Country,Sign_up_date) VALUES (11,'Virginie','Westphalen','vwestphalena@unicef.org','540-242-8726','Virginia','United States','08-Apr-2005');
INSERT INTO customer(Customer_Id,First_Name,Last_Name,Email_ID,Phone_Number,State,Country,Sign_up_date) VALUES (12,'Hervey','Buxcey','hbuxceyb@twitter.com','313-812-1632','Michigan','United States','19-Oct-1999');
INSERT INTO customer(Customer_Id,First_Name,Last_Name,Email_ID,Phone_Number,State,Country,Sign_up_date) VALUES (13,'Fletch','Bultitude','fbultitudec@istockphoto.com','207-461-4242','Hamburg','Germany','23-Apr-2014');
INSERT INTO customer(Customer_Id,First_Name,Last_Name,Email_ID,Phone_Number,State,Country,Sign_up_date) VALUES (14,'Nickolaus','Howlings','nhowlingsd@nature.com','255-411-5506','Niedersachsen','Germany','29-Apr-2016');
INSERT INTO customer(Customer_Id,First_Name,Last_Name,Email_ID,Phone_Number,State,Country,Sign_up_date) VALUES (15,'Ade','McGing','amcginge@merriam-webster.com','915-782-0116','Texas','United States','18-Aug-2013');
INSERT INTO customer(Customer_Id,First_Name,Last_Name,Email_ID,Phone_Number,State,Country,Sign_up_date) VALUES (16,'Christal','Gudgin','cgudginf@yandex.ru','602-879-3045','Arizona','United States','31-Aug-2010');
INSERT INTO customer(Customer_Id,First_Name,Last_Name,Email_ID,Phone_Number,State,Country,Sign_up_date) VALUES (17,'Florie','Wybern','fwyberng@networksolutions.com','469-747-7523','Texas','United States','25-May-2011');
INSERT INTO customer(Customer_Id,First_Name,Last_Name,Email_ID,Phone_Number,State,Country,Sign_up_date) VALUES (18,'Jeanie','Parrett','jparretth@youku.com','832-909-9770','Texas','United States','02-Feb-2014');
INSERT INTO customer(Customer_Id,First_Name,Last_Name,Email_ID,Phone_Number,State,Country,Sign_up_date) VALUES (19,'Pete','Tyson','ptysoni@nasa.gov','314-175-8036','Kentucky','United States','16-Jul-2016');
INSERT INTO customer(Customer_Id,First_Name,Last_Name,Email_ID,Phone_Number,State,Country,Sign_up_date) VALUES (20,'Bobbye','Beynke','bbeynkej@si.edu','558-184-2235','Baden-Württemberg','Germany','10-May-2005');
INSERT INTO customer(Customer_Id,First_Name,Last_Name,Email_ID,Phone_Number,State,Country,Sign_up_date) VALUES (21,'Carlynne','O''Neil','coneilk@comsenz.com','612-731-9991','New South Wales','Australia','15-Sep-2019');
INSERT INTO customer(Customer_Id,First_Name,Last_Name,Email_ID,Phone_Number,State,Country,Sign_up_date) VALUES (22,'Mariette','Fountaine','mfountainel@posterous.com','303-309-3726','Colorado','United States','19-Jan-1999');
INSERT INTO customer(Customer_Id,First_Name,Last_Name,Email_ID,Phone_Number,State,Country,Sign_up_date) VALUES (23,'Ronni','Bullingham','rbullinghamm@umich.edu','214-541-7322','Texas','United States','13-Oct-2011');
INSERT INTO customer(Customer_Id,First_Name,Last_Name,Email_ID,Phone_Number,State,Country,Sign_up_date) VALUES (24,'Lucais','Bourgour','lbourgourn@ocn.ne.jp','260-483-1907','Indiana','United States','31-Dec-2015');
INSERT INTO customer(Customer_Id,First_Name,Last_Name,Email_ID,Phone_Number,State,Country,Sign_up_date) VALUES (25,'Hamil','Newitt','hnewitto@furl.net','812-228-9854','Indiana','United States','17-Mar-2013');
INSERT INTO customer(Customer_Id,First_Name,Last_Name,Email_ID,Phone_Number,State,Country,Sign_up_date) VALUES (26,'Davita','Duffield','dduffieldp@redcross.org','323-525-3761','Schleswig-Holstein','Germany','24-Aug-2017');
INSERT INTO customer(Customer_Id,First_Name,Last_Name,Email_ID,Phone_Number,State,Country,Sign_up_date) VALUES (27,'Laryssa','Manwaring','lmanwaringq@redcross.org','423-918-3553','Tennessee','United States','23-Jan-2011');
INSERT INTO customer(Customer_Id,First_Name,Last_Name,Email_ID,Phone_Number,State,Country,Sign_up_date) VALUES (28,'Kellen','Sloegrave','ksloegraver@ifeng.com','312-330-6800','Illinois','United States','03-Feb-2012');
INSERT INTO customer(Customer_Id,First_Name,Last_Name,Email_ID,Phone_Number,State,Country,Sign_up_date) VALUES (29,'Kyle','Powney','kpowneys@sun.com','502-647-5945','Kentucky','United States','01-Jun-2018');
INSERT INTO customer(Customer_Id,First_Name,Last_Name,Email_ID,Phone_Number,State,Country,Sign_up_date) VALUES (30,'Garvin','Thirst','gthirstt@shutterfly.com','339-625-2465','Massachusetts','United States','21-May-2005');
INSERT INTO customer(Customer_Id,First_Name,Last_Name,Email_ID,Phone_Number,State,Country,Sign_up_date) VALUES (31,'Tann','Cowern','tcowernu@quantcast.com','256-128-4365','Alabama','United States','12-Aug-2016');
INSERT INTO customer(Customer_Id,First_Name,Last_Name,Email_ID,Phone_Number,State,Country,Sign_up_date) VALUES (32,'Raff','Scantlebury','rscantleburyv@simplemachines.org','480-693-5144','Arizona','United States','05-Sep-2000');
INSERT INTO customer(Customer_Id,First_Name,Last_Name,Email_ID,Phone_Number,State,Country,Sign_up_date) VALUES (33,'Llewellyn','Gilbertson','lgilbertsonw@narod.ru','353-461-3881','Hamburg','Germany','19-Jun-1999');
INSERT INTO customer(Customer_Id,First_Name,Last_Name,Email_ID,Phone_Number,State,Country,Sign_up_date) VALUES (34,'Alix','Pawlowicz','apawlowiczx@japanpost.jp','713-376-4340','Texas','United States','07-Jul-2001');
INSERT INTO customer(Customer_Id,First_Name,Last_Name,Email_ID,Phone_Number,State,Country,Sign_up_date) VALUES (35,'Abe','Wearden','aweardeny@usgs.gov','734-847-8062','Michigan','United States','30-Jul-2011');
INSERT INTO customer(Customer_Id,First_Name,Last_Name,Email_ID,Phone_Number,State,Country,Sign_up_date) VALUES (36,'Abdul','Robers','arobersz@engadget.com','901-859-3523','Tennessee','United States','21-Sep-2017');
INSERT INTO customer(Customer_Id,First_Name,Last_Name,Email_ID,Phone_Number,State,Country,Sign_up_date) VALUES (37,'Ware','McDugal','wmcdugal10@1688.com','405-964-1932','Oklahoma','United States','26-Sep-2002');
INSERT INTO customer(Customer_Id,First_Name,Last_Name,Email_ID,Phone_Number,State,Country,Sign_up_date) VALUES (38,'Jorey','Shillabeer','jshillabeer11@lulu.com','509-972-4888','South Australia','Australia','11-Sep-2005');
INSERT INTO customer(Customer_Id,First_Name,Last_Name,Email_ID,Phone_Number,State,Country,Sign_up_date) VALUES (39,'Elinore','Jarman','ejarman12@cmu.edu','859-679-7717','Kentucky','United States','04-Jun-2006');
INSERT INTO customer(Customer_Id,First_Name,Last_Name,Email_ID,Phone_Number,State,Country,Sign_up_date) VALUES (40,'Chandal','Joynson','cjoynson13@soundcloud.com','899-258-0430','Hamburg','Germany','13-Nov-2014');
INSERT INTO customer(Customer_Id,First_Name,Last_Name,Email_ID,Phone_Number,State,Country,Sign_up_date) VALUES (41,'Antonio','Redparth','aredparth14@dot.gov','904-634-9838','Florida','United States','27-Dec-2018');
INSERT INTO customer(Customer_Id,First_Name,Last_Name,Email_ID,Phone_Number,State,Country,Sign_up_date) VALUES (42,'Markos','Isaksson','misaksson15@ucoz.ru','231-360-3392','Michigan','United States','18-Mar-2016');
INSERT INTO customer(Customer_Id,First_Name,Last_Name,Email_ID,Phone_Number,State,Country,Sign_up_date) VALUES (43,'Sanderson','Moffet','smoffet16@va.gov','310-375-2090','California','United States','16-Jan-2004');
INSERT INTO customer(Customer_Id,First_Name,Last_Name,Email_ID,Phone_Number,State,Country,Sign_up_date) VALUES (44,'Marcus','Purdey','mpurdey17@google.com','513-663-9476','Ohio','United States','27-Jun-2001');
INSERT INTO customer(Customer_Id,First_Name,Last_Name,Email_ID,Phone_Number,State,Country,Sign_up_date) VALUES (45,'Riordan','Miall','rmiall18@newsvine.com','305-821-0654','Florida','United States','08-Sep-2005');
INSERT INTO customer(Customer_Id,First_Name,Last_Name,Email_ID,Phone_Number,State,Country,Sign_up_date) VALUES (46,'Cherice','Markussen','cmarkussen19@angelfire.com','894-228-7990','Tasmania','Australia','21-Mar-2009');
INSERT INTO customer(Customer_Id,First_Name,Last_Name,Email_ID,Phone_Number,State,Country,Sign_up_date) VALUES (47,'Etan','Moulden','emoulden1a@icio.us','444-995-2755','Bremen','Germany','22-Feb-2003');
INSERT INTO customer(Customer_Id,First_Name,Last_Name,Email_ID,Phone_Number,State,Country,Sign_up_date) VALUES (48,'Kristin','Anniwell','kanniwell1b@1688.com','815-956-0461','Illinois','United States','27-Jun-2018');
INSERT INTO customer(Customer_Id,First_Name,Last_Name,Email_ID,Phone_Number,State,Country,Sign_up_date) VALUES (49,'Abram','Skitt','askitt1c@google.fr','602-307-9286','Arizona','United States','22-Jul-2019');
INSERT INTO customer(Customer_Id,First_Name,Last_Name,Email_ID,Phone_Number,State,Country,Sign_up_date) VALUES (50,'Darla','Lenney','dlenney1d@columbia.edu','781-862-6859','Massachusetts','United States','23-Jun-2019');
INSERT INTO customer(Customer_Id,First_Name,Last_Name,Email_ID,Phone_Number,State,Country,Sign_up_date) VALUES (51,'Mersey','Iredell','miredell1e@fastcompany.com','812-353-8471','Indiana','United States','12-Dec-2007');
INSERT INTO customer(Customer_Id,First_Name,Last_Name,Email_ID,Phone_Number,State,Country,Sign_up_date) VALUES (52,'Bonnee','Bardwell','bbardwell1f@apple.com','846-116-2599','New South Wales','Australia','14-Jun-2012');
INSERT INTO customer(Customer_Id,First_Name,Last_Name,Email_ID,Phone_Number,State,Country,Sign_up_date) VALUES (53,'Shelagh','Corness','scorness1g@nature.com','330-453-5168','Ohio','United States','06-Dec-2016');
INSERT INTO customer(Customer_Id,First_Name,Last_Name,Email_ID,Phone_Number,State,Country,Sign_up_date) VALUES (54,'Modestia','Giovannoni','mgiovannoni1h@de.vu','801-329-5110','Utah','United States','23-Nov-2001');
INSERT INTO customer(Customer_Id,First_Name,Last_Name,Email_ID,Phone_Number,State,Country,Sign_up_date) VALUES (55,'Kenn','Pierrepoint','kpierrepoint1i@oakley.com','617-755-5197','Massachusetts','United States','15-Feb-2000');
INSERT INTO customer(Customer_Id,First_Name,Last_Name,Email_ID,Phone_Number,State,Country,Sign_up_date) VALUES (56,'Penni','Force','pforce1j@posterous.com','760-546-3774','California','United States','11-Aug-2009');
INSERT INTO customer(Customer_Id,First_Name,Last_Name,Email_ID,Phone_Number,State,Country,Sign_up_date) VALUES (57,'Sheridan','Nutt','snutt1k@wordpress.com','571-715-1996','Virginia','United States','05-May-2019');
INSERT INTO customer(Customer_Id,First_Name,Last_Name,Email_ID,Phone_Number,State,Country,Sign_up_date) VALUES (58,'Emmi','Benley','ebenley1l@time.com','323-974-9225','California','United States','21-Sep-2013');
INSERT INTO customer(Customer_Id,First_Name,Last_Name,Email_ID,Phone_Number,State,Country,Sign_up_date) VALUES (59,'Lorelei','Handyside','lhandyside1m@msu.edu','262-858-6197','Wisconsin','United States','26-Jul-2004');
INSERT INTO customer(Customer_Id,First_Name,Last_Name,Email_ID,Phone_Number,State,Country,Sign_up_date) VALUES (60,'Gill','Normaville','gnormaville1n@quantcast.com','167-985-1317','Sachsen','Germany','22-Sep-2007');
INSERT INTO customer(Customer_Id,First_Name,Last_Name,Email_ID,Phone_Number,State,Country,Sign_up_date) VALUES (61,'Sheilah','Greatland','sgreatland1o@instagram.com','573-551-9189','Missouri','United States','06-Aug-2011');
INSERT INTO customer(Customer_Id,First_Name,Last_Name,Email_ID,Phone_Number,State,Country,Sign_up_date) VALUES (62,'Evangelina','Finker','efinker1p@clickbank.net','918-857-4347','Oklahoma','United States','12-Jul-2010');
INSERT INTO customer(Customer_Id,First_Name,Last_Name,Email_ID,Phone_Number,State,Country,Sign_up_date) VALUES (63,'Chicky','Curee','ccuree1q@so-net.ne.jp','856-334-7285','New Jersey','United States','20-Apr-2002');
INSERT INTO customer(Customer_Id,First_Name,Last_Name,Email_ID,Phone_Number,State,Country,Sign_up_date) VALUES (64,'Melissa','Curnokk','mcurnokk1r@google.com.au','682-956-4879','Texas','United States','08-Aug-2016');
INSERT INTO customer(Customer_Id,First_Name,Last_Name,Email_ID,Phone_Number,State,Country,Sign_up_date) VALUES (65,'Tracey','Nockalls','tnockalls1s@hao123.com','907-753-3193','Alaska','United States','29-Jul-2012');
INSERT INTO customer(Customer_Id,First_Name,Last_Name,Email_ID,Phone_Number,State,Country,Sign_up_date) VALUES (66,'Andrus','Stinson','astinson1t@dagondesign.com','714-545-3562','California','United States','28-Aug-2009');
INSERT INTO customer(Customer_Id,First_Name,Last_Name,Email_ID,Phone_Number,State,Country,Sign_up_date) VALUES (67,'Brocky','Mancell','bmancell1u@businesswire.com','817-192-3439','Texas','United States','21-Nov-1999');
INSERT INTO customer(Customer_Id,First_Name,Last_Name,Email_ID,Phone_Number,State,Country,Sign_up_date) VALUES (68,'Cornall','Godsell','cgodsell1v@elegantthemes.com','845-908-7156','Nordrhein-Westfalen','Germany','01-Sep-2013');
INSERT INTO customer(Customer_Id,First_Name,Last_Name,Email_ID,Phone_Number,State,Country,Sign_up_date) VALUES (69,'Gilbertina','Waters','gwaters1w@surveymonkey.com','310-489-6026','California','United States','02-Oct-2013');
INSERT INTO customer(Customer_Id,First_Name,Last_Name,Email_ID,Phone_Number,State,Country,Sign_up_date) VALUES (70,'Cleo','Haselhurst','chaselhurst1x@skyrock.com','213-156-4530','California','United States','03-May-2019');
INSERT INTO customer(Customer_Id,First_Name,Last_Name,Email_ID,Phone_Number,State,Country,Sign_up_date) VALUES (71,'Ardene','Brotherwood','abrotherwood1y@ning.com','415-893-6261','California','United States','06-May-2004');
INSERT INTO customer(Customer_Id,First_Name,Last_Name,Email_ID,Phone_Number,State,Country,Sign_up_date) VALUES (72,'Lillis','Cowap','lcowap1z@nih.gov','214-166-8858','Texas','United States','27-Jan-2012');
INSERT INTO customer(Customer_Id,First_Name,Last_Name,Email_ID,Phone_Number,State,Country,Sign_up_date) VALUES (73,'Phil','Gillhespy','pgillhespy20@odnoklassniki.ru','949-921-5452','California','United States','19-Aug-2009');
INSERT INTO customer(Customer_Id,First_Name,Last_Name,Email_ID,Phone_Number,State,Country,Sign_up_date) VALUES (74,'Clarinda','McCaskill','cmccaskill21@irs.gov','314-158-9324','Missouri','United States','09-Apr-2001');
INSERT INTO customer(Customer_Id,First_Name,Last_Name,Email_ID,Phone_Number,State,Country,Sign_up_date) VALUES (75,'Agace','Cohane','acohane22@technorati.com','315-492-1224','Western Australia','Australia','27-Feb-2015');
INSERT INTO customer(Customer_Id,First_Name,Last_Name,Email_ID,Phone_Number,State,Country,Sign_up_date) VALUES (76,'Melisande','McKaile','mmckaile23@imgur.com','901-261-2029','Tennessee','United States','29-Aug-2004');
INSERT INTO customer(Customer_Id,First_Name,Last_Name,Email_ID,Phone_Number,State,Country,Sign_up_date) VALUES (77,'Evelyn','Barlass','ebarlass24@ed.gov','979-494-4808','Texas','United States','11-Aug-2016');
INSERT INTO customer(Customer_Id,First_Name,Last_Name,Email_ID,Phone_Number,State,Country,Sign_up_date) VALUES (78,'Niel','Molloy','nmolloy25@tripadvisor.com','610-668-1731','Pennsylvania','United States','05-Oct-2002');
INSERT INTO customer(Customer_Id,First_Name,Last_Name,Email_ID,Phone_Number,State,Country,Sign_up_date) VALUES (79,'Gothart','Rikard','grikard26@soundcloud.com','310-379-0905','California','United States','01-Dec-2013');
INSERT INTO customer(Customer_Id,First_Name,Last_Name,Email_ID,Phone_Number,State,Country,Sign_up_date) VALUES (80,'Pennie','Stagg','pstagg27@apple.com','213-118-6302','California','United States','18-Feb-2000');
INSERT INTO customer(Customer_Id,First_Name,Last_Name,Email_ID,Phone_Number,State,Country,Sign_up_date) VALUES (81,'Tammie','McCarrick','tmccarrick28@cisco.com','510-301-5642','California','United States','21-Nov-2008');
INSERT INTO customer(Customer_Id,First_Name,Last_Name,Email_ID,Phone_Number,State,Country,Sign_up_date) VALUES (82,'Brady','Chedzoy','bchedzoy29@plala.or.jp','828-562-9516','North Carolina','United States','04-May-2015');
INSERT INTO customer(Customer_Id,First_Name,Last_Name,Email_ID,Phone_Number,State,Country,Sign_up_date) VALUES (83,'Wendye','Grady','wgrady2a@sbwire.com','469-687-7611','Texas','United States','04-Jul-2004');
INSERT INTO customer(Customer_Id,First_Name,Last_Name,Email_ID,Phone_Number,State,Country,Sign_up_date) VALUES (84,'Hadlee','Tomlins','htomlins2b@yandex.ru','251-711-2954','Alabama','United States','13-Aug-2002');
INSERT INTO customer(Customer_Id,First_Name,Last_Name,Email_ID,Phone_Number,State,Country,Sign_up_date) VALUES (85,'Hurlee','Crosham','hcrosham2c@reddit.com','513-109-9500','Ohio','United States','10-Jun-2006');
INSERT INTO customer(Customer_Id,First_Name,Last_Name,Email_ID,Phone_Number,State,Country,Sign_up_date) VALUES (86,'Madelin','Calendar','mcalendar2d@auda.org.au','888-115-6800','Nordrhein-Westfalen','Germany','31-Oct-2011');
INSERT INTO customer(Customer_Id,First_Name,Last_Name,Email_ID,Phone_Number,State,Country,Sign_up_date) VALUES (87,'Florenza','Padefield','fpadefield2e@washington.edu','784-618-7730','Hamburg','Germany','29-Dec-2005');
INSERT INTO customer(Customer_Id,First_Name,Last_Name,Email_ID,Phone_Number,State,Country,Sign_up_date) VALUES (88,'Gale','Hubane','ghubane2f@icq.com','209-464-6827','California','United States','26-Jan-2013');
INSERT INTO customer(Customer_Id,First_Name,Last_Name,Email_ID,Phone_Number,State,Country,Sign_up_date) VALUES (89,'Jolie','Semiras','jsemiras2g@reverbnation.com','713-185-2714','Texas','United States','18-May-2000');
INSERT INTO customer(Customer_Id,First_Name,Last_Name,Email_ID,Phone_Number,State,Country,Sign_up_date) VALUES (90,'Laverna','Harder','lharder2h@usa.gov','589-982-5665','Baden-Württemberg','Germany','08-Nov-2001');
INSERT INTO customer(Customer_Id,First_Name,Last_Name,Email_ID,Phone_Number,State,Country,Sign_up_date) VALUES (91,'Gale','Bygreaves','gbygreaves2i@hugedomains.com','408-336-9715','California','United States','29-Oct-2012');
INSERT INTO customer(Customer_Id,First_Name,Last_Name,Email_ID,Phone_Number,State,Country,Sign_up_date) VALUES (92,'Jo','Clac','jclac2j@nasa.gov','512-108-8365','Texas','United States','15-Jun-2014');
INSERT INTO customer(Customer_Id,First_Name,Last_Name,Email_ID,Phone_Number,State,Country,Sign_up_date) VALUES (93,'Dorothee','Bowditch','dbowditch2k@bizjournals.com','212-642-1824','New York','United States','24-Jan-2005');
INSERT INTO customer(Customer_Id,First_Name,Last_Name,Email_ID,Phone_Number,State,Country,Sign_up_date) VALUES (94,'Philomena','Vigar','pvigar2l@apache.org','757-765-9624','Virginia','United States','22-Feb-2006');
INSERT INTO customer(Customer_Id,First_Name,Last_Name,Email_ID,Phone_Number,State,Country,Sign_up_date) VALUES (95,'Diann','Forsdike','dforsdike2m@nbcnews.com','336-208-5758','North Carolina','United States','12-Sep-1999');
INSERT INTO customer(Customer_Id,First_Name,Last_Name,Email_ID,Phone_Number,State,Country,Sign_up_date) VALUES (96,'Anett','Franzke','afranzke2n@tripadvisor.com','714-849-7605','California','United States','05-Nov-2001');
INSERT INTO customer(Customer_Id,First_Name,Last_Name,Email_ID,Phone_Number,State,Country,Sign_up_date) VALUES (97,'Constantine','Hulkes','chulkes2o@msn.com','704-355-8891','North Carolina','United States','06-Feb-2009');
INSERT INTO customer(Customer_Id,First_Name,Last_Name,Email_ID,Phone_Number,State,Country,Sign_up_date) VALUES (98,'Trenton','Fores','tfores2p@typepad.com','524-333-5941','New South Wales','Australia','08-Oct-1999');
INSERT INTO customer(Customer_Id,First_Name,Last_Name,Email_ID,Phone_Number,State,Country,Sign_up_date) VALUES (99,'Cameron','Gosforth','cgosforth2q@cdc.gov','212-129-5023','New York','United States','11-Apr-2015');
INSERT INTO customer(Customer_Id,First_Name,Last_Name,Email_ID,Phone_Number,State,Country,Sign_up_date) VALUES (100,'Tremaine','Dubble','tdubble2r@slate.com','313-336-2543','Michigan','United States','10-Jan-2017');


INSERT INTO Invoice(Invoice_number,Customer_id,Sign_up_date,Plan,Service_period,Payment_method,Total) VALUES (31875,1,'8/7/10','Premium','2010-08-07 to 2010-09-06','MasterCard','$15.99');
INSERT INTO Invoice(Invoice_number,Customer_id,Sign_up_date,Plan,Service_period,Payment_method,Total) VALUES (47074,2,'3/11/09','Standard','2009-03-11 to 2009-04-10','Visa','$12.99');
INSERT INTO Invoice(Invoice_number,Customer_id,Sign_up_date,Plan,Service_period,Payment_method,Total) VALUES (80529,3,'2/7/14','Basic','2014-02-07 to 2014-03-09','Discover','$8.99');
INSERT INTO Invoice(Invoice_number,Customer_id,Sign_up_date,Plan,Service_period,Payment_method,Total) VALUES (25242,4,'11/5/17','Premium','2017-11-05 to 2017-12-05','MasterCard','$15.99');
INSERT INTO Invoice(Invoice_number,Customer_id,Sign_up_date,Plan,Service_period,Payment_method,Total) VALUES (43015,5,'6/25/07','Basic','2007-06-25 to 2007-07-25','Discover','$8.99');
INSERT INTO Invoice(Invoice_number,Customer_id,Sign_up_date,Plan,Service_period,Payment_method,Total) VALUES (68584,6,'8/5/17','Basic','2017-08-05 to 2017-09-04','Visa','$8.99');
INSERT INTO Invoice(Invoice_number,Customer_id,Sign_up_date,Plan,Service_period,Payment_method,Total) VALUES (86500,7,'7/15/19','Premium','2019-07-15 to 2019-08-14','MasterCard','€15.99');
INSERT INTO Invoice(Invoice_number,Customer_id,Sign_up_date,Plan,Service_period,Payment_method,Total) VALUES (63154,8,'6/26/19','Basic','2019-06-26 to 2019-07-26','Discover','€7.99');
INSERT INTO Invoice(Invoice_number,Customer_id,Sign_up_date,Plan,Service_period,Payment_method,Total) VALUES (24588,9,'12/19/00','Standard','2000-12-19 to 2001-01-18','AmericanExpress','$12.99');
INSERT INTO Invoice(Invoice_number,Customer_id,Sign_up_date,Plan,Service_period,Payment_method,Total) VALUES (41365,10,'11/7/06','Premium','2006-11-07 to 2006-12-07','MasterCard','€15.99');
INSERT INTO Invoice(Invoice_number,Customer_id,Sign_up_date,Plan,Service_period,Payment_method,Total) VALUES (74959,11,'4/8/05','Standard','2005-04-08 to 2005-05-08','MasterCard','$12.99');
INSERT INTO Invoice(Invoice_number,Customer_id,Sign_up_date,Plan,Service_period,Payment_method,Total) VALUES (63843,12,'10/19/99','Standard','1999-10-19 to 1999-11-18','MasterCard','$12.99');
INSERT INTO Invoice(Invoice_number,Customer_id,Sign_up_date,Plan,Service_period,Payment_method,Total) VALUES (17760,13,'4/23/14','Premium','2014-04-23 to 2014-05-23','Visa','€15.99');
INSERT INTO Invoice(Invoice_number,Customer_id,Sign_up_date,Plan,Service_period,Payment_method,Total) VALUES (14245,14,'4/29/16','Premium','2016-04-29 to 2016-05-29','Visa','€15.99');
INSERT INTO Invoice(Invoice_number,Customer_id,Sign_up_date,Plan,Service_period,Payment_method,Total) VALUES (30452,15,'8/18/13','Basic','2013-08-18 to 2013-09-17','MasterCard','$8.99');
INSERT INTO Invoice(Invoice_number,Customer_id,Sign_up_date,Plan,Service_period,Payment_method,Total) VALUES (84703,16,'8/31/10','Basic','2010-08-31 to 2010-09-30','Discover','$8.99');
INSERT INTO Invoice(Invoice_number,Customer_id,Sign_up_date,Plan,Service_period,Payment_method,Total) VALUES (25437,17,'5/25/11','Basic','2011-05-25 to 2011-06-24','Visa','$8.99');
INSERT INTO Invoice(Invoice_number,Customer_id,Sign_up_date,Plan,Service_period,Payment_method,Total) VALUES (15649,18,'2/2/14','Basic','2014-02-02 to 2014-03-04','Discover','$8.99');
INSERT INTO Invoice(Invoice_number,Customer_id,Sign_up_date,Plan,Service_period,Payment_method,Total) VALUES (20011,19,'7/16/16','Premium','2016-07-16 to 2016-08-15','Visa','$15.99');
INSERT INTO Invoice(Invoice_number,Customer_id,Sign_up_date,Plan,Service_period,Payment_method,Total) VALUES (22304,20,'5/10/05','Standard','2005-05-10 to 2005-06-09','Visa','€11.99');
INSERT INTO Invoice(Invoice_number,Customer_id,Sign_up_date,Plan,Service_period,Payment_method,Total) VALUES (67591,21,'9/15/19','Standard','2019-09-15 to 2019-10-15','Discover','$13.99');
INSERT INTO Invoice(Invoice_number,Customer_id,Sign_up_date,Plan,Service_period,Payment_method,Total) VALUES (93624,22,'1/19/99','Premium','1999-01-19 to 1999-02-18','Discover','$15.99');
INSERT INTO Invoice(Invoice_number,Customer_id,Sign_up_date,Plan,Service_period,Payment_method,Total) VALUES (88344,23,'10/13/11','Basic','2011-10-13 to 2011-11-12','AmericanExpress','$8.99');
INSERT INTO Invoice(Invoice_number,Customer_id,Sign_up_date,Plan,Service_period,Payment_method,Total) VALUES (41786,24,'12/31/15','Basic','2015-12-31 to 2016-01-30','Discover','$8.99');
INSERT INTO Invoice(Invoice_number,Customer_id,Sign_up_date,Plan,Service_period,Payment_method,Total) VALUES (47467,25,'3/17/13','Basic','2013-03-17 to 2013-04-16','Visa','$8.99');
INSERT INTO Invoice(Invoice_number,Customer_id,Sign_up_date,Plan,Service_period,Payment_method,Total) VALUES (89496,26,'8/24/17','Standard','2017-08-24 to 2017-09-23','MasterCard','€11.99');
INSERT INTO Invoice(Invoice_number,Customer_id,Sign_up_date,Plan,Service_period,Payment_method,Total) VALUES (58983,27,'1/23/11','Basic','2011-01-23 to 2011-02-22','Discover','$8.99');
INSERT INTO Invoice(Invoice_number,Customer_id,Sign_up_date,Plan,Service_period,Payment_method,Total) VALUES (95480,28,'2/3/12','Basic','2012-02-03 to 2012-03-04','Visa','$8.99');
INSERT INTO Invoice(Invoice_number,Customer_id,Sign_up_date,Plan,Service_period,Payment_method,Total) VALUES (80643,29,'6/1/18','Standard','2018-06-01 to 2018-07-01','Discover','$12.99');
INSERT INTO Invoice(Invoice_number,Customer_id,Sign_up_date,Plan,Service_period,Payment_method,Total) VALUES (75675,30,'5/21/05','Standard','2005-05-21 to 2005-06-20','Visa','$12.99');
INSERT INTO Invoice(Invoice_number,Customer_id,Sign_up_date,Plan,Service_period,Payment_method,Total) VALUES (81348,31,'8/12/16','Basic','2016-08-12 to 2016-09-11','Visa','$8.99');
INSERT INTO Invoice(Invoice_number,Customer_id,Sign_up_date,Plan,Service_period,Payment_method,Total) VALUES (67482,32,'9/5/00','Premium','2000-09-05 to 2000-10-05','Discover','$15.99');
INSERT INTO Invoice(Invoice_number,Customer_id,Sign_up_date,Plan,Service_period,Payment_method,Total) VALUES (30338,33,'6/19/99','Premium','1999-06-19 to 1999-07-19','Discover','€15.99');
INSERT INTO Invoice(Invoice_number,Customer_id,Sign_up_date,Plan,Service_period,Payment_method,Total) VALUES (45222,34,'7/7/01','Standard','2001-07-07 to 2001-08-06','AmericanExpress','$12.99');
INSERT INTO Invoice(Invoice_number,Customer_id,Sign_up_date,Plan,Service_period,Payment_method,Total) VALUES (59476,35,'7/30/11','Standard','2011-07-30 to 2011-08-29','Visa','$12.99');
INSERT INTO Invoice(Invoice_number,Customer_id,Sign_up_date,Plan,Service_period,Payment_method,Total) VALUES (41949,36,'9/21/17','Standard','2017-09-21 to 2017-10-21','Visa','$12.99');
INSERT INTO Invoice(Invoice_number,Customer_id,Sign_up_date,Plan,Service_period,Payment_method,Total) VALUES (70609,37,'9/26/02','Premium','2002-09-26 to 2002-10-26','Discover','$15.99');
INSERT INTO Invoice(Invoice_number,Customer_id,Sign_up_date,Plan,Service_period,Payment_method,Total) VALUES (78451,38,'9/11/05','Premium','2005-09-11 to 2005-10-11','MasterCard','$19.99');
INSERT INTO Invoice(Invoice_number,Customer_id,Sign_up_date,Plan,Service_period,Payment_method,Total) VALUES (83814,39,'6/4/06','Standard','2006-06-04 to 2006-07-04','Visa','$12.99');
INSERT INTO Invoice(Invoice_number,Customer_id,Sign_up_date,Plan,Service_period,Payment_method,Total) VALUES (95871,40,'11/13/14','Standard','2014-11-13 to 2014-12-13','Visa','€11.99');
INSERT INTO Invoice(Invoice_number,Customer_id,Sign_up_date,Plan,Service_period,Payment_method,Total) VALUES (62226,41,'12/27/18','Basic','2018-12-27 to 2019-01-26','MasterCard','$8.99');
INSERT INTO Invoice(Invoice_number,Customer_id,Sign_up_date,Plan,Service_period,Payment_method,Total) VALUES (42497,42,'3/18/16','Standard','2016-03-18 to 2016-04-17','MasterCard','$12.99');
INSERT INTO Invoice(Invoice_number,Customer_id,Sign_up_date,Plan,Service_period,Payment_method,Total) VALUES (61811,43,'1/16/04','Basic','2004-01-16 to 2004-02-15','AmericanExpress','$8.99');
INSERT INTO Invoice(Invoice_number,Customer_id,Sign_up_date,Plan,Service_period,Payment_method,Total) VALUES (26490,44,'6/27/01','Basic','2001-06-27 to 2001-07-27','AmericanExpress','$8.99');
INSERT INTO Invoice(Invoice_number,Customer_id,Sign_up_date,Plan,Service_period,Payment_method,Total) VALUES (83492,45,'9/8/05','Standard','2005-09-08 to 2005-10-08','AmericanExpress','$12.99');
INSERT INTO Invoice(Invoice_number,Customer_id,Sign_up_date,Plan,Service_period,Payment_method,Total) VALUES (70619,46,'3/21/09','Basic','2009-03-21 to 2009-04-20','Visa','$9.99');
INSERT INTO Invoice(Invoice_number,Customer_id,Sign_up_date,Plan,Service_period,Payment_method,Total) VALUES (51442,47,'2/22/03','Premium','2003-02-22 to 2003-03-24','Discover','€15.99');
INSERT INTO Invoice(Invoice_number,Customer_id,Sign_up_date,Plan,Service_period,Payment_method,Total) VALUES (15549,48,'6/27/18','Standard','2018-06-27 to 2018-07-27','MasterCard','$12.99');
INSERT INTO Invoice(Invoice_number,Customer_id,Sign_up_date,Plan,Service_period,Payment_method,Total) VALUES (24114,49,'7/22/19','Premium','2019-07-22 to 2019-08-21','Discover','$15.99');
INSERT INTO Invoice(Invoice_number,Customer_id,Sign_up_date,Plan,Service_period,Payment_method,Total) VALUES (65977,50,'6/23/19','Premium','2019-06-23 to 2019-07-23','MasterCard','$15.99');
INSERT INTO Invoice(Invoice_number,Customer_id,Sign_up_date,Plan,Service_period,Payment_method,Total) VALUES (87172,51,'12/12/07','Basic','2007-12-12 to 2008-01-11','Discover','$8.99');
INSERT INTO Invoice(Invoice_number,Customer_id,Sign_up_date,Plan,Service_period,Payment_method,Total) VALUES (21047,52,'6/14/12','Premium','2012-06-14 to 2012-07-14','AmericanExpress','$19.99');
INSERT INTO Invoice(Invoice_number,Customer_id,Sign_up_date,Plan,Service_period,Payment_method,Total) VALUES (34839,53,'12/6/16','Basic','2016-12-06 to 2017-01-05','Discover','$8.99');
INSERT INTO Invoice(Invoice_number,Customer_id,Sign_up_date,Plan,Service_period,Payment_method,Total) VALUES (91226,54,'11/23/01','Premium','2001-11-23 to 2001-12-23','Visa','$15.99');
INSERT INTO Invoice(Invoice_number,Customer_id,Sign_up_date,Plan,Service_period,Payment_method,Total) VALUES (37405,55,'2/15/00','Standard','2000-02-15 to 2000-03-16','AmericanExpress','$12.99');
INSERT INTO Invoice(Invoice_number,Customer_id,Sign_up_date,Plan,Service_period,Payment_method,Total) VALUES (16043,56,'8/11/09','Basic','2009-08-11 to 2009-09-10','Visa','$8.99');
INSERT INTO Invoice(Invoice_number,Customer_id,Sign_up_date,Plan,Service_period,Payment_method,Total) VALUES (29791,57,'5/5/19','Premium','2019-05-05 to 2019-06-04','Visa','$15.99');
INSERT INTO Invoice(Invoice_number,Customer_id,Sign_up_date,Plan,Service_period,Payment_method,Total) VALUES (26056,58,'9/21/13','Basic','2013-09-21 to 2013-10-21','MasterCard','$8.99');
INSERT INTO Invoice(Invoice_number,Customer_id,Sign_up_date,Plan,Service_period,Payment_method,Total) VALUES (93434,59,'7/26/04','Premium','2004-07-26 to 2004-08-25','Visa','$15.99');
INSERT INTO Invoice(Invoice_number,Customer_id,Sign_up_date,Plan,Service_period,Payment_method,Total) VALUES (75744,60,'9/22/07','Standard','2007-09-22 to 2007-10-22','Discover','€11.99');
INSERT INTO Invoice(Invoice_number,Customer_id,Sign_up_date,Plan,Service_period,Payment_method,Total) VALUES (72716,61,'8/6/11','Premium','2011-08-06 to 2011-09-05','MasterCard','$15.99');
INSERT INTO Invoice(Invoice_number,Customer_id,Sign_up_date,Plan,Service_period,Payment_method,Total) VALUES (16805,62,'7/12/10','Standard','2010-07-12 to 2010-08-11','Discover','$12.99');
INSERT INTO Invoice(Invoice_number,Customer_id,Sign_up_date,Plan,Service_period,Payment_method,Total) VALUES (54389,63,'4/20/02','Premium','2002-04-20 to 2002-05-20','Discover','$15.99');
INSERT INTO Invoice(Invoice_number,Customer_id,Sign_up_date,Plan,Service_period,Payment_method,Total) VALUES (93511,64,'8/8/16','Premium','2016-08-08 to 2016-09-07','Discover','$15.99');
INSERT INTO Invoice(Invoice_number,Customer_id,Sign_up_date,Plan,Service_period,Payment_method,Total) VALUES (84336,65,'7/29/12','Basic','2012-07-29 to 2012-08-28','MasterCard','$8.99');
INSERT INTO Invoice(Invoice_number,Customer_id,Sign_up_date,Plan,Service_period,Payment_method,Total) VALUES (82253,66,'8/28/09','Standard','2009-08-28 to 2009-09-27','AmericanExpress','$12.99');
INSERT INTO Invoice(Invoice_number,Customer_id,Sign_up_date,Plan,Service_period,Payment_method,Total) VALUES (81575,67,'11/21/99','Premium','1999-11-21 to 1999-12-21','MasterCard','$15.99');
INSERT INTO Invoice(Invoice_number,Customer_id,Sign_up_date,Plan,Service_period,Payment_method,Total) VALUES (93325,68,'9/1/13','Basic','2013-09-01 to 2013-10-01','Discover','€7.99');
INSERT INTO Invoice(Invoice_number,Customer_id,Sign_up_date,Plan,Service_period,Payment_method,Total) VALUES (15485,69,'10/2/13','Basic','2013-10-02 to 2013-11-01','Discover','$8.99');
INSERT INTO Invoice(Invoice_number,Customer_id,Sign_up_date,Plan,Service_period,Payment_method,Total) VALUES (67999,70,'5/3/19','Basic','2019-05-03 to 2019-06-02','AmericanExpress','$8.99');
INSERT INTO Invoice(Invoice_number,Customer_id,Sign_up_date,Plan,Service_period,Payment_method,Total) VALUES (81151,71,'5/6/04','Basic','2004-05-06 to 2004-06-05','AmericanExpress','$8.99');
INSERT INTO Invoice(Invoice_number,Customer_id,Sign_up_date,Plan,Service_period,Payment_method,Total) VALUES (53163,72,'1/27/12','Standard','2012-01-27 to 2012-02-26','Discover','$12.99');
INSERT INTO Invoice(Invoice_number,Customer_id,Sign_up_date,Plan,Service_period,Payment_method,Total) VALUES (97458,73,'8/19/09','Standard','2009-08-19 to 2009-09-18','Discover','$12.99');
INSERT INTO Invoice(Invoice_number,Customer_id,Sign_up_date,Plan,Service_period,Payment_method,Total) VALUES (25599,74,'4/9/01','Premium','2001-04-09 to 2001-05-09','MasterCard','$15.99');
INSERT INTO Invoice(Invoice_number,Customer_id,Sign_up_date,Plan,Service_period,Payment_method,Total) VALUES (89084,75,'2/27/15','Basic','2015-02-27 to 2015-03-29','AmericanExpress','$9.99');
INSERT INTO Invoice(Invoice_number,Customer_id,Sign_up_date,Plan,Service_period,Payment_method,Total) VALUES (57403,76,'8/29/04','Premium','2004-08-29 to 2004-09-28','Visa','$15.99');
INSERT INTO Invoice(Invoice_number,Customer_id,Sign_up_date,Plan,Service_period,Payment_method,Total) VALUES (10430,77,'8/11/16','Basic','2016-08-11 to 2016-09-10','AmericanExpress','$8.99');
INSERT INTO Invoice(Invoice_number,Customer_id,Sign_up_date,Plan,Service_period,Payment_method,Total) VALUES (29021,78,'10/5/02','Standard','2002-10-05 to 2002-11-04','AmericanExpress','$12.99');
INSERT INTO Invoice(Invoice_number,Customer_id,Sign_up_date,Plan,Service_period,Payment_method,Total) VALUES (48256,79,'12/1/13','Standard','2013-12-01 to 2013-12-31','MasterCard','$12.99');
INSERT INTO Invoice(Invoice_number,Customer_id,Sign_up_date,Plan,Service_period,Payment_method,Total) VALUES (64863,80,'2/18/00','Premium','2000-02-18 to 2000-03-19','AmericanExpress','$15.99');
INSERT INTO Invoice(Invoice_number,Customer_id,Sign_up_date,Plan,Service_period,Payment_method,Total) VALUES (62466,81,'11/21/08','Premium','2008-11-21 to 2008-12-21','MasterCard','$15.99');
INSERT INTO Invoice(Invoice_number,Customer_id,Sign_up_date,Plan,Service_period,Payment_method,Total) VALUES (91960,82,'5/4/15','Basic','2015-05-04 to 2015-06-03','MasterCard','$8.99');
INSERT INTO Invoice(Invoice_number,Customer_id,Sign_up_date,Plan,Service_period,Payment_method,Total) VALUES (14058,83,'7/4/04','Basic','2004-07-04 to 2004-08-03','Visa','$8.99');
INSERT INTO Invoice(Invoice_number,Customer_id,Sign_up_date,Plan,Service_period,Payment_method,Total) VALUES (25766,84,'8/13/02','Standard','2002-08-13 to 2002-09-12','AmericanExpress','$12.99');
INSERT INTO Invoice(Invoice_number,Customer_id,Sign_up_date,Plan,Service_period,Payment_method,Total) VALUES (97641,85,'6/10/06','Premium','2006-06-10 to 2006-07-10','MasterCard','$15.99');
INSERT INTO Invoice(Invoice_number,Customer_id,Sign_up_date,Plan,Service_period,Payment_method,Total) VALUES (53829,86,'10/31/11','Premium','2011-10-31 to 2011-11-30','Visa','€15.99');
INSERT INTO Invoice(Invoice_number,Customer_id,Sign_up_date,Plan,Service_period,Payment_method,Total) VALUES (36413,87,'12/29/05','Standard','2005-12-29 to 2006-01-28','MasterCard','€11.99');
INSERT INTO Invoice(Invoice_number,Customer_id,Sign_up_date,Plan,Service_period,Payment_method,Total) VALUES (34931,88,'1/26/13','Premium','2013-01-26 to 2013-02-25','AmericanExpress','$15.99');
INSERT INTO Invoice(Invoice_number,Customer_id,Sign_up_date,Plan,Service_period,Payment_method,Total) VALUES (54057,89,'5/18/00','Standard','2000-05-18 to 2000-06-17','AmericanExpress','$12.99');
INSERT INTO Invoice(Invoice_number,Customer_id,Sign_up_date,Plan,Service_period,Payment_method,Total) VALUES (82875,90,'11/8/01','Premium','2001-11-08 to 2001-12-08','Discover','€15.99');
INSERT INTO Invoice(Invoice_number,Customer_id,Sign_up_date,Plan,Service_period,Payment_method,Total) VALUES (71890,91,'10/29/12','Standard','2012-10-29 to 2012-11-28','Discover','$12.99');
INSERT INTO Invoice(Invoice_number,Customer_id,Sign_up_date,Plan,Service_period,Payment_method,Total) VALUES (21459,92,'6/15/14','Standard','2014-06-15 to 2014-07-15','MasterCard','$12.99');
INSERT INTO Invoice(Invoice_number,Customer_id,Sign_up_date,Plan,Service_period,Payment_method,Total) VALUES (95380,93,'1/24/05','Standard','2005-01-24 to 2005-02-23','MasterCard','$12.99');
INSERT INTO Invoice(Invoice_number,Customer_id,Sign_up_date,Plan,Service_period,Payment_method,Total) VALUES (32491,94,'2/22/06','Basic','2006-02-22 to 2006-03-24','MasterCard','$8.99');
INSERT INTO Invoice(Invoice_number,Customer_id,Sign_up_date,Plan,Service_period,Payment_method,Total) VALUES (91604,95,'9/12/99','Basic','1999-09-12 to 1999-10-12','Visa','$8.99');
INSERT INTO Invoice(Invoice_number,Customer_id,Sign_up_date,Plan,Service_period,Payment_method,Total) VALUES (69708,96,'11/5/01','Standard','2001-11-05 to 2001-12-05','Visa','$12.99');
INSERT INTO Invoice(Invoice_number,Customer_id,Sign_up_date,Plan,Service_period,Payment_method,Total) VALUES (12478,97,'2/6/09','Premium','2009-02-06 to 2009-03-08','AmericanExpress','$15.99');
INSERT INTO Invoice(Invoice_number,Customer_id,Sign_up_date,Plan,Service_period,Payment_method,Total) VALUES (22868,98,'10/8/99','Basic','1999-10-08 to 1999-11-07','MasterCard','$9.99');
INSERT INTO Invoice(Invoice_number,Customer_id,Sign_up_date,Plan,Service_period,Payment_method,Total) VALUES (45515,99,'4/11/15','Premium','2015-04-11 to 2015-05-11','AmericanExpress','$15.99');
INSERT INTO Invoice(Invoice_number,Customer_id,Sign_up_date,Plan,Service_period,Payment_method,Total) VALUES (82459,100,'1/10/17','Standard','2017-01-10 to 2017-02-09','AmericanExpress','$12.99');

);

insert into streams (Stream_id, Customer_id, Content_id, Stream_date, Stream_time, Stream_duration, Stream_rating) values (2, 48, 91, '04-Sep-2019', '8:39 PM', 22, 3);
insert into streams (Stream_id, Customer_id, Content_id, Stream_date, Stream_time, Stream_duration, Stream_rating) values (3, 92, 2, '25-Jan-2019', '9:47 PM', 85, 3);
insert into streams (Stream_id, Customer_id, Content_id, Stream_date, Stream_time, Stream_duration, Stream_rating) values (4, 85, 63, '17-Jan-2019', '5:53 PM', 5, 2);
insert into streams (Stream_id, Customer_id, Content_id, Stream_date, Stream_time, Stream_duration, Stream_rating) values (5, 72, 1, '15-Nov-2018', '9:51 AM', 44, 1);
insert into streams (Stream_id, Customer_id, Content_id, Stream_date, Stream_time, Stream_duration, Stream_rating) values (6, 88, 70, '18-Oct-2019', '12:49 PM', 5, 4);
insert into streams (Stream_id, Customer_id, Content_id, Stream_date, Stream_time, Stream_duration, Stream_rating) values (8, 26, 83, '19-Oct-2019', '5:04 PM', 84, 2);
insert into streams (Stream_id, Customer_id, Content_id, Stream_date, Stream_time, Stream_duration, Stream_rating) values (9, 86, 30, '26-Oct-2019', '7:45 AM', 28, 5);
insert into streams (Stream_id, Customer_id, Content_id, Stream_date, Stream_time, Stream_duration, Stream_rating) values (10, 3, 69, '30-Jan-2019', '2:17 PM', 49, 3);
insert into streams (Stream_id, Customer_id, Content_id, Stream_date, Stream_time, Stream_duration, Stream_rating) values (11, 60, 40, '25-Oct-2019', '10:17 PM', 62, 5);
insert into streams (Stream_id, Customer_id, Content_id, Stream_date, Stream_time, Stream_duration, Stream_rating) values (12, 58, 47, '06-Jul-2019', '5:34 AM', 70, 5);
insert into streams (Stream_id, Customer_id, Content_id, Stream_date, Stream_time, Stream_duration, Stream_rating) values (13, 53, 33, '23-Sep-2019', '8:02 PM', 12, 3);
insert into streams (Stream_id, Customer_id, Content_id, Stream_date, Stream_time, Stream_duration, Stream_rating) values (14, 43, 69, '20-Jul-2019', '1:29 AM', 53, 4);
insert into streams (Stream_id, Customer_id, Content_id, Stream_date, Stream_time, Stream_duration, Stream_rating) values (15, 90, 49, '20-Oct-2019', '12:06 PM', 49, 1);
insert into streams (Stream_id, Customer_id, Content_id, Stream_date, Stream_time, Stream_duration, Stream_rating) values (16, 13, 89, '20-Oct-2019', '8:02 PM', 29, 5);
insert into streams (Stream_id, Customer_id, Content_id, Stream_date, Stream_time, Stream_duration, Stream_rating) values (17, 3, 57, '30-Mar-2019', '11:31 AM', 32, 5);
insert into streams (Stream_id, Customer_id, Content_id, Stream_date, Stream_time, Stream_duration, Stream_rating) values (18, 28, 14, '20-Nov-2018', '12:41 AM', 33, 2);
insert into streams (Stream_id, Customer_id, Content_id, Stream_date, Stream_time, Stream_duration, Stream_rating) values (19, 2, 2, '24-Jun-2019', '8:04 PM', 50, 4);
insert into streams (Stream_id, Customer_id, Content_id, Stream_date, Stream_time, Stream_duration, Stream_rating) values (20, 88, 67, '18-Apr-2019', '10:38 AM', 53, 1);
insert into streams (Stream_id, Customer_id, Content_id, Stream_date, Stream_time, Stream_duration, Stream_rating) values (21, 17, 46, '26-Mar-2019', '6:40 PM', 83, 5);
insert into streams (Stream_id, Customer_id, Content_id, Stream_date, Stream_time, Stream_duration, Stream_rating) values (22, 66, 36, '05-May-2019', '3:17 AM', 74, 3);
insert into streams (Stream_id, Customer_id, Content_id, Stream_date, Stream_time, Stream_duration, Stream_rating) values (23, 5, 81, '17-Apr-2019', '6:34 AM', 7, 5);
insert into streams (Stream_id, Customer_id, Content_id, Stream_date, Stream_time, Stream_duration, Stream_rating) values (24, 25, 93, '28-Aug-2019', '7:24 AM', 77, 1);
insert into streams (Stream_id, Customer_id, Content_id, Stream_date, Stream_time, Stream_duration, Stream_rating) values (25, 58, 95, '02-Oct-2019', '3:12 PM', 17, 4);
insert into streams (Stream_id, Customer_id, Content_id, Stream_date, Stream_time, Stream_duration, Stream_rating) values (26, 30, 37, '14-Dec-2018', '4:41 AM', 77, 3);
insert into streams (Stream_id, Customer_id, Content_id, Stream_date, Stream_time, Stream_duration, Stream_rating) values (27, 59, 91, '28-Mar-2019', '11:33 AM', 57, 2);

insert into streams (Stream_id, Customer_id, Content_id, Stream_date, Stream_time, Stream_duration, Stream_rating) values (29, 2, 81, '23-Aug-2019', '7:33 PM', 55, 4);
insert into streams (Stream_id, Customer_id, Content_id, Stream_date, Stream_time, Stream_duration, Stream_rating) values (30, 31, 18, '24-Jun-2019', '4:11 AM', 64, 3);
insert into streams (Stream_id, Customer_id, Content_id, Stream_date, Stream_time, Stream_duration, Stream_rating) values (31, 65, 55, '27-Apr-2019', '3:31 PM', 9, 3);
insert into streams (Stream_id, Customer_id, Content_id, Stream_date, Stream_time, Stream_duration, Stream_rating) values (32, 99, 60, '22-Apr-2019', '11:20 AM', 4, 3);
insert into streams (Stream_id, Customer_id, Content_id, Stream_date, Stream_time, Stream_duration, Stream_rating) values (33, 88, 64, '24-Apr-2019', '2:23 AM', 75, 4);
insert into streams (Stream_id, Customer_id, Content_id, Stream_date, Stream_time, Stream_duration, Stream_rating) values (34, 31, 96, '28-Nov-2018', '8:29 PM', 5, 2);
insert into streams (Stream_id, Customer_id, Content_id, Stream_date, Stream_time, Stream_duration, Stream_rating) values (35, 88, 89, '13-May-2019', '4:01 AM', 91, 3);
insert into streams (Stream_id, Customer_id, Content_id, Stream_date, Stream_time, Stream_duration, Stream_rating) values (36, 96, 24, '24-Jul-2019', '10:53 AM', 93, 2);
insert into streams (Stream_id, Customer_id, Content_id, Stream_date, Stream_time, Stream_duration, Stream_rating) values (37, 66, 57, '19-Feb-2019', '3:44 AM', 59, 3);
insert into streams (Stream_id, Customer_id, Content_id, Stream_date, Stream_time, Stream_duration, Stream_rating) values (38, 14, 93, '08-Mar-2019', '4:42 AM', 2, 1);
insert into streams (Stream_id, Customer_id, Content_id, Stream_date, Stream_time, Stream_duration, Stream_rating) values (39, 66, 40, '21-Dec-2018', '1:12 PM', 30, 3);
insert into streams (Stream_id, Customer_id, Content_id, Stream_date, Stream_time, Stream_duration, Stream_rating) values (40, 94, 84, '07-Jun-2019', '10:52 PM', 21, 3);
insert into streams (Stream_id, Customer_id, Content_id, Stream_date, Stream_time, Stream_duration, Stream_rating) values (41, 76, 5, '26-Jun-2019', '12:38 AM', 5, 2);
insert into streams (Stream_id, Customer_id, Content_id, Stream_date, Stream_time, Stream_duration, Stream_rating) values (42, 34, 36, '30-Dec-2018', '6:43 PM', 22, 1);
insert into streams (Stream_id, Customer_id, Content_id, Stream_date, Stream_time, Stream_duration, Stream_rating) values (43, 76, 48, '06-Jun-2019', '2:21 AM', 33, 4);
insert into streams (Stream_id, Customer_id, Content_id, Stream_date, Stream_time, Stream_duration, Stream_rating) values (44, 48, 26, '16-May-2019', '3:25 PM', 21, 4);
insert into streams (Stream_id, Customer_id, Content_id, Stream_date, Stream_time, Stream_duration, Stream_rating) values (45, 7, 63, '13-Feb-2019', '6:24 AM', 36, 1);
insert into streams (Stream_id, Customer_id, Content_id, Stream_date, Stream_time, Stream_duration, Stream_rating) values (46, 64, 89, '29-Sep-2019', '4:47 PM', 56, 5);
insert into streams (Stream_id, Customer_id, Content_id, Stream_date, Stream_time, Stream_duration, Stream_rating) values (47, 47, 100, '30-Jun-2019', '9:08 PM', 53, 5);
insert into streams (Stream_id, Customer_id, Content_id, Stream_date, Stream_time, Stream_duration, Stream_rating) values (48, 94, 58, '13-Aug-2019', '11:44 AM', 48, 4);
insert into streams (Stream_id, Customer_id, Content_id, Stream_date, Stream_time, Stream_duration, Stream_rating) values (49, 25, 54, '10-Feb-2019', '6:47 PM', 87, 3);
insert into streams (Stream_id, Customer_id, Content_id, Stream_date, Stream_time, Stream_duration, Stream_rating) values (50, 78, 96, '05-Oct-2019', '1:06 AM', 28, 5);
insert into streams (Stream_id, Customer_id, Content_id, Stream_date, Stream_time, Stream_duration, Stream_rating) values (51, 89, 5, '08-Jun-2019', '1:39 PM', 54, 3);
insert into streams (Stream_id, Customer_id, Content_id, Stream_date, Stream_time, Stream_duration, Stream_rating) values (52, 8, 18, '08-Jul-2019', '1:56 AM', 4, 5);
insert into streams (Stream_id, Customer_id, Content_id, Stream_date, Stream_time, Stream_duration, Stream_rating) values (53, 45, 14, '12-Aug-2019', '2:01 AM', 15, 3);
insert into streams (Stream_id, Customer_id, Content_id, Stream_date, Stream_time, Stream_duration, Stream_rating) values (54, 18, 84, '06-Jun-2019', '3:00 PM', 73, 4);
insert into streams (Stream_id, Customer_id, Content_id, Stream_date, Stream_time, Stream_duration, Stream_rating) values (55, 67, 39, '09-Oct-2019', '8:24 AM', 90, 2);
insert into streams (Stream_id, Customer_id, Content_id, Stream_date, Stream_time, Stream_duration, Stream_rating) values (56, 45, 50, '02-Mar-2019', '8:19 AM', 51, 5);
insert into streams (Stream_id, Customer_id, Content_id, Stream_date, Stream_time, Stream_duration, Stream_rating) values (57, 35, 91, '07-Jul-2019', '12:58 AM', 83, 2);
insert into streams (Stream_id, Customer_id, Content_id, Stream_date, Stream_time, Stream_duration, Stream_rating) values (58, 66, 2, '29-Sep-2019', '5:59 PM', 40, 1);
insert into streams (Stream_id, Customer_id, Content_id, Stream_date, Stream_time, Stream_duration, Stream_rating) values (59, 36, 5, '04-Dec-2018', '7:50 PM', 55, 3);
insert into streams (Stream_id, Customer_id, Content_id, Stream_date, Stream_time, Stream_duration, Stream_rating) values (60, 94, 53, '16-Aug-2019', '4:55 PM', 46, 4);
insert into streams (Stream_id, Customer_id, Content_id, Stream_date, Stream_time, Stream_duration, Stream_rating) values (61, 100, 29, '02-May-2019', '5:03 PM', 82, 4);
insert into streams (Stream_id, Customer_id, Content_id, Stream_date, Stream_time, Stream_duration, Stream_rating) values (62, 91, 18, '18-May-2019', '3:30 PM', 19, 5);
insert into streams (Stream_id, Customer_id, Content_id, Stream_date, Stream_time, Stream_duration, Stream_rating) values (63, 62, 19, '16-Mar-2019', '6:09 AM', 62, 3);
insert into streams (Stream_id, Customer_id, Content_id, Stream_date, Stream_time, Stream_duration, Stream_rating) values (64, 100, 94, '10-Apr-2019', '12:03 PM', 85, 4);
insert into streams (Stream_id, Customer_id, Content_id, Stream_date, Stream_time, Stream_duration, Stream_rating) values (65, 50, 74, '28-Oct-2019', '10:34 AM', 41, 1);
insert into streams (Stream_id, Customer_id, Content_id, Stream_date, Stream_time, Stream_duration, Stream_rating) values (66, 70, 31, '12-Oct-2019', '7:02 PM', 85, 2);
insert into streams (Stream_id, Customer_id, Content_id, Stream_date, Stream_time, Stream_duration, Stream_rating) values (67, 35, 73, '13-Nov-2018', '3:36 PM', 93, 1);
insert into streams (Stream_id, Customer_id, Content_id, Stream_date, Stream_time, Stream_duration, Stream_rating) values (68, 45, 31, '22-Feb-2019', '6:03 PM', 77, 3);
insert into streams (Stream_id, Customer_id, Content_id, Stream_date, Stream_time, Stream_duration, Stream_rating) values (69, 21, 69, '11-Oct-2019', '6:37 PM', 51, 4);
insert into streams (Stream_id, Customer_id, Content_id, Stream_date, Stream_time, Stream_duration, Stream_rating) values (70, 17, 34, '18-Jun-2019', '7:04 PM', 45, 3);
insert into streams (Stream_id, Customer_id, Content_id, Stream_date, Stream_time, Stream_duration, Stream_rating) values (71, 55, 40, '17-Sep-2019', '11:33 AM', 47, 3);
insert into streams (Stream_id, Customer_id, Content_id, Stream_date, Stream_time, Stream_duration, Stream_rating) values (72, 96, 8, '22-Aug-2019', '11:03 PM', 2, 1);
insert into streams (Stream_id, Customer_id, Content_id, Stream_date, Stream_time, Stream_duration, Stream_rating) values (73, 95, 40, '28-Dec-2018', '10:27 PM', 97, 2);
insert into streams (Stream_id, Customer_id, Content_id, Stream_date, Stream_time, Stream_duration, Stream_rating) values (74, 95, 84, '13-Feb-2019', '4:20 AM', 53, 2);
insert into streams (Stream_id, Customer_id, Content_id, Stream_date, Stream_time, Stream_duration, Stream_rating) values (75, 42, 73, '22-Feb-2019', '11:55 AM', 95, 5);
insert into streams (Stream_id, Customer_id, Content_id, Stream_date, Stream_time, Stream_duration, Stream_rating) values (76, 74, 71, '03-Oct-2019', '8:23 PM', 50, 5);
insert into streams (Stream_id, Customer_id, Content_id, Stream_date, Stream_time, Stream_duration, Stream_rating) values (77, 22, 31, '27-Jun-2019', '6:16 PM', 36, 1);
insert into streams (Stream_id, Customer_id, Content_id, Stream_date, Stream_time, Stream_duration, Stream_rating) values (78, 30, 63, '14-May-2019', '4:21 PM', 49, 3);
insert into streams (Stream_id, Customer_id, Content_id, Stream_date, Stream_time, Stream_duration, Stream_rating) values (79, 10, 33, '31-Aug-2019', '5:16 PM', 5, 4);
insert into streams (Stream_id, Customer_id, Content_id, Stream_date, Stream_time, Stream_duration, Stream_rating) values (80, 21, 79, '22-Oct-2019', '12:59 AM', 67, 1);
insert into streams (Stream_id, Customer_id, Content_id, Stream_date, Stream_time, Stream_duration, Stream_rating) values (81, 69, 73, '03-Mar-2019', '12:22 AM', 93, 5);
insert into streams (Stream_id, Customer_id, Content_id, Stream_date, Stream_time, Stream_duration, Stream_rating) values (82, 74, 99, '11-Nov-2018', '7:58 PM', 39, 4);
insert into streams (Stream_id, Customer_id, Content_id, Stream_date, Stream_time, Stream_duration, Stream_rating) values (83, 36, 19, '16-Aug-2019', '6:35 PM', 3, 3);
insert into streams (Stream_id, Customer_id, Content_id, Stream_date, Stream_time, Stream_duration, Stream_rating) values (84, 93, 27, '25-Nov-2018', '12:58 AM', 47, 1);
insert into streams (Stream_id, Customer_id, Content_id, Stream_date, Stream_time, Stream_duration, Stream_rating) values (85, 64, 40, '27-Feb-2019', '1:01 AM', 8, 3);
insert into streams (Stream_id, Customer_id, Content_id, Stream_date, Stream_time, Stream_duration, Stream_rating) values (86, 97, 47, '24-Nov-2018', '4:08 PM', 68, 3);
insert into streams (Stream_id, Customer_id, Content_id, Stream_date, Stream_time, Stream_duration, Stream_rating) values (87, 26, 61, '20-Aug-2019', '9:20 PM', 100, 4);
insert into streams (Stream_id, Customer_id, Content_id, Stream_date, Stream_time, Stream_duration, Stream_rating) values (88, 93, 50, '28-Jul-2019', '12:38 AM', 7, 4);
insert into streams (Stream_id, Customer_id, Content_id, Stream_date, Stream_time, Stream_duration, Stream_rating) values (89, 49, 17, '02-Aug-2019', '6:42 PM', 19, 5);
insert into streams (Stream_id, Customer_id, Content_id, Stream_date, Stream_time, Stream_duration, Stream_rating) values (90, 77, 36, '13-Jul-2019', '5:30 AM', 43, 3);
insert into streams (Stream_id, Customer_id, Content_id, Stream_date, Stream_time, Stream_duration, Stream_rating) values (91, 61, 5, '19-Dec-2018', '4:37 PM', 6, 1);
insert into streams (Stream_id, Customer_id, Content_id, Stream_date, Stream_time, Stream_duration, Stream_rating) values (92, 68, 84, '25-Oct-2019', '9:41 PM', 76, 5);
insert into streams (Stream_id, Customer_id, Content_id, Stream_date, Stream_time, Stream_duration, Stream_rating) values (93, 67, 5, '22-Oct-2019', '6:12 AM', 31, 5);
insert into streams (Stream_id, Customer_id, Content_id, Stream_date, Stream_time, Stream_duration, Stream_rating) values (94, 8, 34, '17-May-2019', '3:48 AM', 31, 3);
insert into streams (Stream_id, Customer_id, Content_id, Stream_date, Stream_time, Stream_duration, Stream_rating) values (95, 72, 52, '15-Apr-2019', '3:09 AM', 69, 4);
insert into streams (Stream_id, Customer_id, Content_id, Stream_date, Stream_time, Stream_duration, Stream_rating) values (96, 54, 95, '22-May-2019', '5:34 AM', 95, 1);
insert into streams (Stream_id, Customer_id, Content_id, Stream_date, Stream_time, Stream_duration, Stream_rating) values (97, 2, 18, '21-Sep-2019', '7:19 AM', 80, 1);
insert into streams (Stream_id, Customer_id, Content_id, Stream_date, Stream_time, Stream_duration, Stream_rating) values (98, 95, 83, '09-Dec-2018', '2:05 PM', 95, 5);
insert into streams (Stream_id, Customer_id, Content_id, Stream_date, Stream_time, Stream_duration, Stream_rating) values (99, 31, 96, '06-Feb-2019', '11:55 AM', 9, 1);
insert into streams (Stream_id, Customer_id, Content_id, Stream_date, Stream_time, Stream_duration, Stream_rating) values (100, 58, 2, '03-Jun-2019', '2:08 PM', 26, 5);
insert into streams (Stream_id, Customer_id, Content_id, Stream_date, Stream_time, Stream_duration, Stream_rating) values (101, 92, 72, '13-Jun-2019', '9:08 PM', 87, 1);
insert into streams (Stream_id, Customer_id, Content_id, Stream_date, Stream_time, Stream_duration, Stream_rating) values (102, 91, 25, '18-Jan-2019', '4:51 PM', 61, 3);
insert into streams (Stream_id, Customer_id, Content_id, Stream_date, Stream_time, Stream_duration, Stream_rating) values (103, 91, 91, '25-Dec-2018', '1:29 AM', 22, 5);
insert into streams (Stream_id, Customer_id, Content_id, Stream_date, Stream_time, Stream_duration, Stream_rating) values (104, 18, 53, '11-Dec-2018', '6:26 PM', 98, 4);
insert into streams (Stream_id, Customer_id, Content_id, Stream_date, Stream_time, Stream_duration, Stream_rating) values (105, 100, 23, '02-Apr-2019', '11:54 PM', 77, 5);
insert into streams (Stream_id, Customer_id, Content_id, Stream_date, Stream_time, Stream_duration, Stream_rating) values (106, 69, 57, '01-May-2019', '7:54 PM', 68, 4);
insert into streams (Stream_id, Customer_id, Content_id, Stream_date, Stream_time, Stream_duration, Stream_rating) values (107, 21, 44, '06-Jul-2019', '5:12 AM', 43, 3);
insert into streams (Stream_id, Customer_id, Content_id, Stream_date, Stream_time, Stream_duration, Stream_rating) values (108, 19, 88, '09-Sep-2019', '9:28 PM', 33, 1);
insert into streams (Stream_id, Customer_id, Content_id, Stream_date, Stream_time, Stream_duration, Stream_rating) values (109, 83, 20, '17-Jan-2019', '11:38 PM', 49, 5);
insert into streams (Stream_id, Customer_id, Content_id, Stream_date, Stream_time, Stream_duration, Stream_rating) values (110, 58, 73, '18-May-2019', '2:37 AM', 41, 1);
insert into streams (Stream_id, Customer_id, Content_id, Stream_date, Stream_time, Stream_duration, Stream_rating) values (111, 66, 85, '19-Dec-2018', '3:34 AM', 50, 2);
insert into streams (Stream_id, Customer_id, Content_id, Stream_date, Stream_time, Stream_duration, Stream_rating) values (112, 94, 93, '13-Jan-2019', '12:46 AM', 29, 1);
insert into streams (Stream_id, Customer_id, Content_id, Stream_date, Stream_time, Stream_duration, Stream_rating) values (113, 8, 27, '20-Apr-2019', '11:36 PM', 39, 3);
insert into streams (Stream_id, Customer_id, Content_id, Stream_date, Stream_time, Stream_duration, Stream_rating) values (114, 96, 70, '19-May-2019', '6:07 PM', 86, 2);
insert into streams (Stream_id, Customer_id, Content_id, Stream_date, Stream_time, Stream_duration, Stream_rating) values (115, 17, 94, '04-Nov-2019', '1:04 AM', 34, 4);
insert into streams (Stream_id, Customer_id, Content_id, Stream_date, Stream_time, Stream_duration, Stream_rating) values (116, 29, 2, '27-Feb-2019', '5:00 AM', 44, 2);
insert into streams (Stream_id, Customer_id, Content_id, Stream_date, Stream_time, Stream_duration, Stream_rating) values (117, 86, 15, '02-Feb-2019', '1:58 AM', 69, 5);
insert into streams (Stream_id, Customer_id, Content_id, Stream_date, Stream_time, Stream_duration, Stream_rating) values (118, 90, 7, '14-Mar-2019', '2:23 PM', 22, 3);
insert into streams (Stream_id, Customer_id, Content_id, Stream_date, Stream_time, Stream_duration, Stream_rating) values (119, 21, 52, '14-Aug-2019', '9:06 AM', 27, 2);
insert into streams (Stream_id, Customer_id, Content_id, Stream_date, Stream_time, Stream_duration, Stream_rating) values (120, 67, 56, '12-Mar-2019', '3:43 AM', 16, 5);
insert into streams (Stream_id, Customer_id, Content_id, Stream_date, Stream_time, Stream_duration, Stream_rating) values (121, 63, 54, '17-May-2019', '1:39 PM', 70, 2);
insert into streams (Stream_id, Customer_id, Content_id, Stream_date, Stream_time, Stream_duration, Stream_rating) values (122, 25, 22, '25-Dec-2018', '7:02 PM', 19, 1);
insert into streams (Stream_id, Customer_id, Content_id, Stream_date, Stream_time, Stream_duration, Stream_rating) values (123, 39, 31, '30-Jul-2019', '6:47 AM', 21, 4);
insert into streams (Stream_id, Customer_id, Content_id, Stream_date, Stream_time, Stream_duration, Stream_rating) values (124, 29, 21, '13-May-2019', '4:41 PM', 56, 5);
insert into streams (Stream_id, Customer_id, Content_id, Stream_date, Stream_time, Stream_duration, Stream_rating) values (125, 32, 78, '17-Sep-2019', '9:23 PM', 92, 1);
insert into streams (Stream_id, Customer_id, Content_id, Stream_date, Stream_time, Stream_duration, Stream_rating) values (126, 75, 2, '25-Sep-2019', '7:51 PM', 1, 5);
insert into streams (Stream_id, Customer_id, Content_id, Stream_date, Stream_time, Stream_duration, Stream_rating) values (127, 71, 37, '11-Mar-2019', '9:12 AM', 93, 4);
insert into streams (Stream_id, Customer_id, Content_id, Stream_date, Stream_time, Stream_duration, Stream_rating) values (128, 52, 69, '03-Apr-2019', '6:47 PM', 77, 4);
insert into streams (Stream_id, Customer_id, Content_id, Stream_date, Stream_time, Stream_duration, Stream_rating) values (129, 76, 80, '01-Feb-2019', '7:52 PM', 69, 1);
insert into streams (Stream_id, Customer_id, Content_id, Stream_date, Stream_time, Stream_duration, Stream_rating) values (130, 68, 52, '30-Sep-2019', '4:08 AM', 21, 2);
insert into streams (Stream_id, Customer_id, Content_id, Stream_date, Stream_time, Stream_duration, Stream_rating) values (131, 96, 74, '27-Aug-2019', '1:07 PM', 8, 5);
insert into streams (Stream_id, Customer_id, Content_id, Stream_date, Stream_time, Stream_duration, Stream_rating) values (132, 63, 95, '01-Dec-2018', '7:33 AM', 22, 1);
insert into streams (Stream_id, Customer_id, Content_id, Stream_date, Stream_time, Stream_duration, Stream_rating) values (133, 81, 83, '24-Jan-2019', '8:02 PM', 16, 3);
insert into streams (Stream_id, Customer_id, Content_id, Stream_date, Stream_time, Stream_duration, Stream_rating) values (134, 36, 87, '18-Aug-2019', '4:44 AM', 71, 2);
insert into streams (Stream_id, Customer_id, Content_id, Stream_date, Stream_time, Stream_duration, Stream_rating) values (135, 11, 15, '19-Feb-2019', '7:26 PM', 28, 1);
insert into streams (Stream_id, Customer_id, Content_id, Stream_date, Stream_time, Stream_duration, Stream_rating) values (136, 58, 4, '12-Nov-2018', '5:44 AM', 65, 5);
insert into streams (Stream_id, Customer_id, Content_id, Stream_date, Stream_time, Stream_duration, Stream_rating) values (137, 32, 99, '04-May-2019', '2:59 PM', 98, 1);
insert into streams (Stream_id, Customer_id, Content_id, Stream_date, Stream_time, Stream_duration, Stream_rating) values (138, 44, 86, '31-May-2019', '4:07 PM', 8, 5);
insert into streams (Stream_id, Customer_id, Content_id, Stream_date, Stream_time, Stream_duration, Stream_rating) values (139, 55, 21, '11-Nov-2018', '2:27 AM', 17, 1);
insert into streams (Stream_id, Customer_id, Content_id, Stream_date, Stream_time, Stream_duration, Stream_rating) values (140, 25, 22, '27-Oct-2019', '10:35 AM', 2, 5);
insert into streams (Stream_id, Customer_id, Content_id, Stream_date, Stream_time, Stream_duration, Stream_rating) values (142, 52, 63, '03-Sep-2019', '10:40 PM', 2, 2);
insert into streams (Stream_id, Customer_id, Content_id, Stream_date, Stream_time, Stream_duration, Stream_rating) values (143, 10, 19, '20-Oct-2019', '1:38 PM', 91, 4);
insert into streams (Stream_id, Customer_id, Content_id, Stream_date, Stream_time, Stream_duration, Stream_rating) values (144, 52, 68, '07-Jul-2019', '8:37 PM', 4, 1);
insert into streams (Stream_id, Customer_id, Content_id, Stream_date, Stream_time, Stream_duration, Stream_rating) values (145, 95, 46, '02-Oct-2019', '6:43 PM', 35, 1);
insert into streams (Stream_id, Customer_id, Content_id, Stream_date, Stream_time, Stream_duration, Stream_rating) values (146, 47, 56, '02-May-2019', '9:50 PM', 63, 4);
insert into streams (Stream_id, Customer_id, Content_id, Stream_date, Stream_time, Stream_duration, Stream_rating) values (147, 28, 91, '06-Jan-2019', '4:18 PM', 49, 3);
insert into streams (Stream_id, Customer_id, Content_id, Stream_date, Stream_time, Stream_duration, Stream_rating) values (148, 5, 90, '03-Dec-2018', '5:36 PM', 16, 5);
insert into streams (Stream_id, Customer_id, Content_id, Stream_date, Stream_time, Stream_duration, Stream_rating) values (149, 54, 61, '01-Jun-2019', '10:36 PM', 39, 1);
insert into streams (Stream_id, Customer_id, Content_id, Stream_date, Stream_time, Stream_duration, Stream_rating) values (150, 77, 39, '19-Aug-2019', '3:23 PM', 79, 3);
insert into streams (Stream_id, Customer_id, Content_id, Stream_date, Stream_time, Stream_duration, Stream_rating) values (151, 27, 65, '07-Feb-2019', '1:13 AM', 36, 1);
insert into streams (Stream_id, Customer_id, Content_id, Stream_date, Stream_time, Stream_duration, Stream_rating) values (152, 73, 97, '04-May-2019', '7:27 PM', 26, 5);
insert into streams (Stream_id, Customer_id, Content_id, Stream_date, Stream_time, Stream_duration, Stream_rating) values (153, 16, 67, '25-May-2019', '10:48 AM', 14, 2);
insert into streams (Stream_id, Customer_id, Content_id, Stream_date, Stream_time, Stream_duration, Stream_rating) values (154, 80, 28, '12-Sep-2019', '2:41 AM', 43, 3);
insert into streams (Stream_id, Customer_id, Content_id, Stream_date, Stream_time, Stream_duration, Stream_rating) values (155, 42, 5, '15-Sep-2019', '6:11 AM', 77, 5);
insert into streams (Stream_id, Customer_id, Content_id, Stream_date, Stream_time, Stream_duration, Stream_rating) values (156, 42, 54, '16-May-2019', '11:06 PM', 50, 2);
insert into streams (Stream_id, Customer_id, Content_id, Stream_date, Stream_time, Stream_duration, Stream_rating) values (157, 24, 54, '31-Jan-2019', '1:58 AM', 35, 3);
insert into streams (Stream_id, Customer_id, Content_id, Stream_date, Stream_time, Stream_duration, Stream_rating) values (158, 13, 71, '04-Sep-2019', '11:58 PM', 22, 1);
insert into streams (Stream_id, Customer_id, Content_id, Stream_date, Stream_time, Stream_duration, Stream_rating) values (159, 48, 21, '12-Nov-2018', '1:46 PM', 9, 5);
insert into streams (Stream_id, Customer_id, Content_id, Stream_date, Stream_time, Stream_duration, Stream_rating) values (160, 51, 80, '21-Apr-2019', '9:33 PM', 26, 2);
insert into streams (Stream_id, Customer_id, Content_id, Stream_date, Stream_time, Stream_duration, Stream_rating) values (161, 70, 7, '22-Jan-2019', '2:59 AM', 2, 5);
insert into streams (Stream_id, Customer_id, Content_id, Stream_date, Stream_time, Stream_duration, Stream_rating) values (164, 48, 90, '03-Oct-2019', '10:39 AM', 15, 1);
insert into streams (Stream_id, Customer_id, Content_id, Stream_date, Stream_time, Stream_duration, Stream_rating) values (165, 55, 63, '12-Dec-2018', '9:02 PM', 16, 5);
insert into streams (Stream_id, Customer_id, Content_id, Stream_date, Stream_time, Stream_duration, Stream_rating) values (166, 53, 25, '20-Nov-2018', '10:34 AM', 81, 5);
insert into streams (Stream_id, Customer_id, Content_id, Stream_date, Stream_time, Stream_duration, Stream_rating) values (167, 39, 37, '27-Mar-2019', '1:22 AM', 34, 4);
insert into streams (Stream_id, Customer_id, Content_id, Stream_date, Stream_time, Stream_duration, Stream_rating) values (168, 56, 98, '03-Jan-2019', '12:14 AM', 58, 1);
insert into streams (Stream_id, Customer_id, Content_id, Stream_date, Stream_time, Stream_duration, Stream_rating) values (169, 49, 26, '01-Dec-2018', '7:32 AM', 23, 1);
insert into streams (Stream_id, Customer_id, Content_id, Stream_date, Stream_time, Stream_duration, Stream_rating) values (170, 47, 65, '16-Dec-2018', '9:20 AM', 12, 4);
insert into streams (Stream_id, Customer_id, Content_id, Stream_date, Stream_time, Stream_duration, Stream_rating) values (171, 13, 40, '03-Apr-2019', '11:19 PM', 74, 3);
insert into streams (Stream_id, Customer_id, Content_id, Stream_date, Stream_time, Stream_duration, Stream_rating) values (172, 95, 10, '12-Jul-2019', '8:03 PM', 38, 3);
insert into streams (Stream_id, Customer_id, Content_id, Stream_date, Stream_time, Stream_duration, Stream_rating) values (173, 78, 13, '19-Jul-2019', '2:41 AM', 65, 5);
insert into streams (Stream_id, Customer_id, Content_id, Stream_date, Stream_time, Stream_duration, Stream_rating) values (174, 61, 88, '02-Jun-2019', '12:51 PM', 59, 5);
insert into streams (Stream_id, Customer_id, Content_id, Stream_date, Stream_time, Stream_duration, Stream_rating) values (175, 30, 47, '22-May-2019', '8:37 AM', 5, 5);
insert into streams (Stream_id, Customer_id, Content_id, Stream_date, Stream_time, Stream_duration, Stream_rating) values (176, 68, 47, '18-Mar-2019', '6:48 AM', 37, 3);
insert into streams (Stream_id, Customer_id, Content_id, Stream_date, Stream_time, Stream_duration, Stream_rating) values (177, 65, 76, '28-Apr-2019', '11:55 AM', 72, 4);
insert into streams (Stream_id, Customer_id, Content_id, Stream_date, Stream_time, Stream_duration, Stream_rating) values (178, 37, 54, '16-Nov-2018', '8:48 AM', 75, 4);
insert into streams (Stream_id, Customer_id, Content_id, Stream_date, Stream_time, Stream_duration, Stream_rating) values (179, 33, 1, '24-Mar-2019', '3:12 PM', 90, 3);
insert into streams (Stream_id, Customer_id, Content_id, Stream_date, Stream_time, Stream_duration, Stream_rating) values (180, 76, 58, '10-Jan-2019', '6:34 PM', 9, 3);
insert into streams (Stream_id, Customer_id, Content_id, Stream_date, Stream_time, Stream_duration, Stream_rating) values (181, 85, 100, '14-Jan-2019', '2:45 PM', 73, 2);
insert into streams (Stream_id, Customer_id, Content_id, Stream_date, Stream_time, Stream_duration, Stream_rating) values (182, 47, 66, '13-Jan-2019', '3:40 AM', 72, 5);
insert into streams (Stream_id, Customer_id, Content_id, Stream_date, Stream_time, Stream_duration, Stream_rating) values (183, 50, 78, '16-Aug-2019', '1:12 AM', 38, 3);
insert into streams (Stream_id, Customer_id, Content_id, Stream_date, Stream_time, Stream_duration, Stream_rating) values (184, 13, 46, '30-Jun-2019', '11:29 PM', 39, 3);
insert into streams (Stream_id, Customer_id, Content_id, Stream_date, Stream_time, Stream_duration, Stream_rating) values (185, 96, 37, '29-Aug-2019', '5:22 AM', 96, 5);
insert into streams (Stream_id, Customer_id, Content_id, Stream_date, Stream_time, Stream_duration, Stream_rating) values (186, 18, 86, '02-Jan-2019', '1:29 AM', 91, 4);
insert into streams (Stream_id, Customer_id, Content_id, Stream_date, Stream_time, Stream_duration, Stream_rating) values (187, 33, 30, '02-Jun-2019', '2:15 PM', 1, 2);
insert into streams (Stream_id, Customer_id, Content_id, Stream_date, Stream_time, Stream_duration, Stream_rating) values (188, 87, 48, '30-Jan-2019', '10:19 AM', 76, 4);
insert into streams (Stream_id, Customer_id, Content_id, Stream_date, Stream_time, Stream_duration, Stream_rating) values (189, 69, 17, '12-Aug-2019', '10:38 AM', 65, 2);
insert into streams (Stream_id, Customer_id, Content_id, Stream_date, Stream_time, Stream_duration, Stream_rating) values (190, 33, 95, '26-Sep-2019', '6:29 PM', 64, 4);
insert into streams (Stream_id, Customer_id, Content_id, Stream_date, Stream_time, Stream_duration, Stream_rating) values (191, 14, 64, '01-Oct-2019', '3:23 PM', 59, 2);
insert into streams (Stream_id, Customer_id, Content_id, Stream_date, Stream_time, Stream_duration, Stream_rating) values (192, 62, 20, '28-Aug-2019', '5:50 PM', 83, 1);
insert into streams (Stream_id, Customer_id, Content_id, Stream_date, Stream_time, Stream_duration, Stream_rating) values (193, 29, 4, '20-Feb-2019', '8:05 PM', 51, 4);
insert into streams (Stream_id, Customer_id, Content_id, Stream_date, Stream_time, Stream_duration, Stream_rating) values (194, 24, 62, '16-Apr-2019', '2:38 AM', 24, 1);
insert into streams (Stream_id, Customer_id, Content_id, Stream_date, Stream_time, Stream_duration, Stream_rating) values (195, 17, 57, '08-Jun-2019', '10:20 AM', 16, 1);
insert into streams (Stream_id, Customer_id, Content_id, Stream_date, Stream_time, Stream_duration, Stream_rating) values (196, 13, 70, '19-Mar-2019', '4:48 AM', 14, 3);
insert into streams (Stream_id, Customer_id, Content_id, Stream_date, Stream_time, Stream_duration, Stream_rating) values (197, 11, 19, '04-Sep-2019', '7:06 PM', 99, 5);
insert into streams (Stream_id, Customer_id, Content_id, Stream_date, Stream_time, Stream_duration, Stream_rating) values (198, 58, 61, '05-Oct-2019', '4:12 PM', 71, 4);
insert into streams (Stream_id, Customer_id, Content_id, Stream_date, Stream_time, Stream_duration, Stream_rating) values (199, 2, 82, '13-Sep-2019', '12:21 PM', 41, 1);
insert into streams (Stream_id, Customer_id, Content_id, Stream_date, Stream_time, Stream_duration, Stream_rating) values (200, 58, 4, '06-Aug-2019', '8:28 PM', 30, 1);
insert into streams (Stream_id, Customer_id, Content_id, Stream_date, Stream_time, Stream_duration, Stream_rating) values (201, 47, 11, '24-Dec-2018', '6:02 AM', 74, 2);
insert into streams (Stream_id, Customer_id, Content_id, Stream_date, Stream_time, Stream_duration, Stream_rating) values (202, 88, 61, '23-Aug-2019', '1:42 PM', 48, 2);
insert into streams (Stream_id, Customer_id, Content_id, Stream_date, Stream_time, Stream_duration, Stream_rating) values (203, 24, 33, '21-Jan-2019', '5:36 PM', 93, 4);
insert into streams (Stream_id, Customer_id, Content_id, Stream_date, Stream_time, Stream_duration, Stream_rating) values (204, 43, 50, '02-Oct-2019', '8:20 AM', 74, 4);
insert into streams (Stream_id, Customer_id, Content_id, Stream_date, Stream_time, Stream_duration, Stream_rating) values (205, 29, 53, '25-Dec-2018', '9:50 AM', 9, 4);
insert into streams (Stream_id, Customer_id, Content_id, Stream_date, Stream_time, Stream_duration, Stream_rating) values (206, 96, 44, '13-Jun-2019', '7:49 AM', 35, 3);
insert into streams (Stream_id, Customer_id, Content_id, Stream_date, Stream_time, Stream_duration, Stream_rating) values (207, 3, 98, '14-Sep-2019', '7:06 AM', 49, 2);
insert into streams (Stream_id, Customer_id, Content_id, Stream_date, Stream_time, Stream_duration, Stream_rating) values (208, 50, 74, '06-Oct-2019', '8:59 AM', 81, 3);
insert into streams (Stream_id, Customer_id, Content_id, Stream_date, Stream_time, Stream_duration, Stream_rating) values (209, 39, 63, '04-Nov-2019', '2:28 AM', 30, 3);
insert into streams (Stream_id, Customer_id, Content_id, Stream_date, Stream_time, Stream_duration, Stream_rating) values (210, 42, 40, '29-Nov-2018', '1:45 PM', 12, 3);
insert into streams (Stream_id, Customer_id, Content_id, Stream_date, Stream_time, Stream_duration, Stream_rating) values (211, 94, 36, '02-Jun-2019', '7:53 PM', 40, 1);
insert into streams (Stream_id, Customer_id, Content_id, Stream_date, Stream_time, Stream_duration, Stream_rating) values (212, 1, 19, '19-Jan-2019', '1:35 AM', 72, 2);
insert into streams (Stream_id, Customer_id, Content_id, Stream_date, Stream_time, Stream_duration, Stream_rating) values (213, 84, 14, '23-Sep-2019', '2:38 PM', 16, 1);
insert into streams (Stream_id, Customer_id, Content_id, Stream_date, Stream_time, Stream_duration, Stream_rating) values (214, 84, 61, '08-Oct-2019', '4:49 PM', 11, 2);
insert into streams (Stream_id, Customer_id, Content_id, Stream_date, Stream_time, Stream_duration, Stream_rating) values (215, 15, 54, '05-Aug-2019', '6:01 PM', 92, 3);
insert into streams (Stream_id, Customer_id, Content_id, Stream_date, Stream_time, Stream_duration, Stream_rating) values (216, 86, 50, '23-Sep-2019', '9:41 PM', 40, 1);
insert into streams (Stream_id, Customer_id, Content_id, Stream_date, Stream_time, Stream_duration, Stream_rating) values (217, 19, 80, '11-Dec-2018', '8:38 AM', 55, 3);
insert into streams (Stream_id, Customer_id, Content_id, Stream_date, Stream_time, Stream_duration, Stream_rating) values (218, 23, 48, '04-Jul-2019', '2:30 PM', 87, 2);
insert into streams (Stream_id, Customer_id, Content_id, Stream_date, Stream_time, Stream_duration, Stream_rating) values (219, 86, 98, '07-Jul-2019', '10:46 AM', 26, 2);
insert into streams (Stream_id, Customer_id, Content_id, Stream_date, Stream_time, Stream_duration, Stream_rating) values (220, 13, 74, '23-Jan-2019', '4:49 PM', 24, 2);
insert into streams (Stream_id, Customer_id, Content_id, Stream_date, Stream_time, Stream_duration, Stream_rating) values (221, 85, 27, '16-Jan-2019', '8:56 AM', 61, 2);
insert into streams (Stream_id, Customer_id, Content_id, Stream_date, Stream_time, Stream_duration, Stream_rating) values (222, 99, 26, '11-Apr-2019', '4:07 PM', 25, 3);

insert into streams (Stream_id, Customer_id, Content_id, Stream_date, Stream_time, Stream_duration, Stream_rating) values (224, 39, 98, '30-Oct-2019', '12:53 PM', 50, 1);
insert into streams (Stream_id, Customer_id, Content_id, Stream_date, Stream_time, Stream_duration, Stream_rating) values (225, 63, 63, '07-May-2019', '6:02 PM', 21, 4);
insert into streams (Stream_id, Customer_id, Content_id, Stream_date, Stream_time, Stream_duration, Stream_rating) values (226, 50, 69, '06-May-2019', '1:16 PM', 66, 1);
insert into streams (Stream_id, Customer_id, Content_id, Stream_date, Stream_time, Stream_duration, Stream_rating) values (227, 94, 24, '27-Dec-2018', '10:08 AM', 27, 3);
insert into streams (Stream_id, Customer_id, Content_id, Stream_date, Stream_time, Stream_duration, Stream_rating) values (228, 60, 7, '25-Jul-2019', '1:09 PM', 82, 3);
insert into streams (Stream_id, Customer_id, Content_id, Stream_date, Stream_time, Stream_duration, Stream_rating) values (229, 30, 40, '07-Nov-2019', '11:30 AM', 79, 5);
insert into streams (Stream_id, Customer_id, Content_id, Stream_date, Stream_time, Stream_duration, Stream_rating) values (230, 37, 28, '17-Oct-2019', '11:41 PM', 83, 5);
insert into streams (Stream_id, Customer_id, Content_id, Stream_date, Stream_time, Stream_duration, Stream_rating) values (231, 13, 64, '09-Jun-2019', '9:13 PM', 73, 2);
insert into streams (Stream_id, Customer_id, Content_id, Stream_date, Stream_time, Stream_duration, Stream_rating) values (232, 54, 100, '02-Mar-2019', '3:36 PM', 81, 3);
insert into streams (Stream_id, Customer_id, Content_id, Stream_date, Stream_time, Stream_duration, Stream_rating) values (233, 57, 72, '19-Jul-2019', '8:01 PM', 35, 5);
insert into streams (Stream_id, Customer_id, Content_id, Stream_date, Stream_time, Stream_duration, Stream_rating) values (234, 58, 99, '11-Apr-2019', '12:37 PM', 92, 1);
insert into streams (Stream_id, Customer_id, Content_id, Stream_date, Stream_time, Stream_duration, Stream_rating) values (235, 53, 57, '19-Dec-2018', '10:07 PM', 7, 1);
insert into streams (Stream_id, Customer_id, Content_id, Stream_date, Stream_time, Stream_duration, Stream_rating) values (236, 22, 46, '19-Dec-2018', '4:44 PM', 17, 4);
insert into streams (Stream_id, Customer_id, Content_id, Stream_date, Stream_time, Stream_duration, Stream_rating) values (237, 2, 64, '09-Jul-2019', '8:35 PM', 76, 1);
insert into streams (Stream_id, Customer_id, Content_id, Stream_date, Stream_time, Stream_duration, Stream_rating) values (238, 73, 78, '02-Apr-2019', '7:51 PM', 74, 1);
insert into streams (Stream_id, Customer_id, Content_id, Stream_date, Stream_time, Stream_duration, Stream_rating) values (239, 82, 55, '07-Mar-2019', '3:47 AM', 77, 4);
insert into streams (Stream_id, Customer_id, Content_id, Stream_date, Stream_time, Stream_duration, Stream_rating) values (240, 90, 58, '26-Mar-2019', '7:12 AM', 5, 2);
insert into streams (Stream_id, Customer_id, Content_id, Stream_date, Stream_time, Stream_duration, Stream_rating) values (241, 14, 29, '19-Aug-2019', '11:52 PM', 50, 4);
insert into streams (Stream_id, Customer_id, Content_id, Stream_date, Stream_time, Stream_duration, Stream_rating) values (242, 63, 21, '04-Mar-2019', '11:30 PM', 38, 3);
insert into streams (Stream_id, Customer_id, Content_id, Stream_date, Stream_time, Stream_duration, Stream_rating) values (243, 88, 52, '16-Apr-2019', '10:12 AM', 74, 1);
insert into streams (Stream_id, Customer_id, Content_id, Stream_date, Stream_time, Stream_duration, Stream_rating) values (244, 37, 4, '12-Sep-2019', '11:07 AM', 23, 3);
insert into streams (Stream_id, Customer_id, Content_id, Stream_date, Stream_time, Stream_duration, Stream_rating) values (245, 56, 20, '14-Oct-2019', '12:42 AM', 77, 5);
insert into streams (Stream_id, Customer_id, Content_id, Stream_date, Stream_time, Stream_duration, Stream_rating) values (246, 71, 74, '23-Jan-2019', '11:24 AM', 14, 5);
insert into streams (Stream_id, Customer_id, Content_id, Stream_date, Stream_time, Stream_duration, Stream_rating) values (247, 12, 74, '29-Nov-2018', '1:25 AM', 54, 4);
insert into streams (Stream_id, Customer_id, Content_id, Stream_date, Stream_time, Stream_duration, Stream_rating) values (248, 85, 60, '14-Jun-2019', '4:08 PM', 31, 2);
insert into streams (Stream_id, Customer_id, Content_id, Stream_date, Stream_time, Stream_duration, Stream_rating) values (249, 24, 50, '24-Aug-2019', '10:10 AM', 41, 4);
insert into streams (Stream_id, Customer_id, Content_id, Stream_date, Stream_time, Stream_duration, Stream_rating) values (250, 18, 39, '18-Dec-2018', '12:28 PM', 34, 5);
insert into streams (Stream_id, Customer_id, Content_id, Stream_date, Stream_time, Stream_duration, Stream_rating) values (251, 46, 73, '27-Nov-2018', '9:04 PM', 8, 3);
insert into streams (Stream_id, Customer_id, Content_id, Stream_date, Stream_time, Stream_duration, Stream_rating) values (252, 36, 78, '19-Jan-2019', '5:55 PM', 92, 5);
insert into streams (Stream_id, Customer_id, Content_id, Stream_date, Stream_time, Stream_duration, Stream_rating) values (253, 73, 10, '06-Sep-2019', '1:55 AM', 38, 1);
insert into streams (Stream_id, Customer_id, Content_id, Stream_date, Stream_time, Stream_duration, Stream_rating) values (254, 71, 96, '01-Jan-2019', '11:20 AM', 49, 4);
insert into streams (Stream_id, Customer_id, Content_id, Stream_date, Stream_time, Stream_duration, Stream_rating) values (255, 61, 60, '16-May-2019', '5:58 PM', 34, 2);
insert into streams (Stream_id, Customer_id, Content_id, Stream_date, Stream_time, Stream_duration, Stream_rating) values (256, 47, 48, '10-May-2019', '11:39 PM', 10, 2);
insert into streams (Stream_id, Customer_id, Content_id, Stream_date, Stream_time, Stream_duration, Stream_rating) values (257, 29, 57, '23-Nov-2018', '8:34 AM', 44, 5);
insert into streams (Stream_id, Customer_id, Content_id, Stream_date, Stream_time, Stream_duration, Stream_rating) values (258, 46, 69, '06-Feb-2019', '8:35 PM', 86, 1);
insert into streams (Stream_id, Customer_id, Content_id, Stream_date, Stream_time, Stream_duration, Stream_rating) values (259, 17, 24, '29-Mar-2019', '2:03 AM', 35, 3);
insert into streams (Stream_id, Customer_id, Content_id, Stream_date, Stream_time, Stream_duration, Stream_rating) values (260, 36, 71, '03-Sep-2019', '3:49 PM', 41, 2);
insert into streams (Stream_id, Customer_id, Content_id, Stream_date, Stream_time, Stream_duration, Stream_rating) values (261, 52, 28, '22-Mar-2019', '11:14 PM', 5, 3);
insert into streams (Stream_id, Customer_id, Content_id, Stream_date, Stream_time, Stream_duration, Stream_rating) values (262, 9, 45, '17-Oct-2019', '12:32 PM', 44, 2);
insert into streams (Stream_id, Customer_id, Content_id, Stream_date, Stream_time, Stream_duration, Stream_rating) values (263, 86, 31, '12-Jul-2019', '12:22 AM', 60, 4);
insert into streams (Stream_id, Customer_id, Content_id, Stream_date, Stream_time, Stream_duration, Stream_rating) values (264, 7, 99, '10-Feb-2019', '1:04 AM', 2, 1);
insert into streams (Stream_id, Customer_id, Content_id, Stream_date, Stream_time, Stream_duration, Stream_rating) values (265, 75, 99, '23-Jun-2019', '1:32 AM', 21, 1);
insert into streams (Stream_id, Customer_id, Content_id, Stream_date, Stream_time, Stream_duration, Stream_rating) values (266, 3, 38, '20-Dec-2018', '8:12 AM', 12, 4);
insert into streams (Stream_id, Customer_id, Content_id, Stream_date, Stream_time, Stream_duration, Stream_rating) values (267, 61, 34, '23-Jan-2019', '2:45 PM', 41, 1);
insert into streams (Stream_id, Customer_id, Content_id, Stream_date, Stream_time, Stream_duration, Stream_rating) values (268, 47, 72, '16-Sep-2019', '2:37 AM', 4, 5);
insert into streams (Stream_id, Customer_id, Content_id, Stream_date, Stream_time, Stream_duration, Stream_rating) values (269, 70, 70, '16-Mar-2019', '2:50 PM', 56, 5);
insert into streams (Stream_id, Customer_id, Content_id, Stream_date, Stream_time, Stream_duration, Stream_rating) values (270, 62, 89, '08-Jun-2019', '7:31 AM', 80, 3);
insert into streams (Stream_id, Customer_id, Content_id, Stream_date, Stream_time, Stream_duration, Stream_rating) values (271, 49, 55, '18-Mar-2019', '2:09 PM', 79, 1);
insert into streams (Stream_id, Customer_id, Content_id, Stream_date, Stream_time, Stream_duration, Stream_rating) values (272, 8, 20, '23-Apr-2019', '1:33 PM', 59, 1);
insert into streams (Stream_id, Customer_id, Content_id, Stream_date, Stream_time, Stream_duration, Stream_rating) values (273, 55, 13, '12-Jun-2019', '1:44 PM', 7, 4);
insert into streams (Stream_id, Customer_id, Content_id, Stream_date, Stream_time, Stream_duration, Stream_rating) values (274, 25, 93, '30-Sep-2019', '3:59 PM', 85, 1);
insert into streams (Stream_id, Customer_id, Content_id, Stream_date, Stream_time, Stream_duration, Stream_rating) values (275, 39, 24, '20-May-2019', '2:52 AM', 19, 2);
insert into streams (Stream_id, Customer_id, Content_id, Stream_date, Stream_time, Stream_duration, Stream_rating) values (276, 92, 8, '11-Aug-2019', '2:17 PM', 68, 1);
insert into streams (Stream_id, Customer_id, Content_id, Stream_date, Stream_time, Stream_duration, Stream_rating) values (277, 84, 59, '17-Jul-2019', '2:33 AM', 93, 4);
insert into streams (Stream_id, Customer_id, Content_id, Stream_date, Stream_time, Stream_duration, Stream_rating) values (278, 18, 54, '03-Nov-2019', '8:33 PM', 61, 4);
insert into streams (Stream_id, Customer_id, Content_id, Stream_date, Stream_time, Stream_duration, Stream_rating) values (279, 50, 85, '11-Nov-2018', '6:28 AM', 74, 1);
insert into streams (Stream_id, Customer_id, Content_id, Stream_date, Stream_time, Stream_duration, Stream_rating) values (280, 92, 43, '05-Sep-2019', '7:37 PM', 27, 2);
insert into streams (Stream_id, Customer_id, Content_id, Stream_date, Stream_time, Stream_duration, Stream_rating) values (281, 78, 51, '29-Apr-2019', '10:54 PM', 5, 2);
insert into streams (Stream_id, Customer_id, Content_id, Stream_date, Stream_time, Stream_duration, Stream_rating) values (282, 45, 84, '03-Feb-2019', '6:40 PM', 97, 5);
insert into streams (Stream_id, Customer_id, Content_id, Stream_date, Stream_time, Stream_duration, Stream_rating) values (283, 34, 62, '02-Mar-2019', '3:56 PM', 9, 3);
insert into streams (Stream_id, Customer_id, Content_id, Stream_date, Stream_time, Stream_duration, Stream_rating) values (284, 43, 52, '08-Oct-2019', '9:15 PM', 52, 2);
insert into streams (Stream_id, Customer_id, Content_id, Stream_date, Stream_time, Stream_duration, Stream_rating) values (285, 23, 53, '31-May-2019', '2:42 PM', 4, 4);
insert into streams (Stream_id, Customer_id, Content_id, Stream_date, Stream_time, Stream_duration, Stream_rating) values (286, 84, 24, '29-Dec-2018', '6:55 PM', 86, 3);
insert into streams (Stream_id, Customer_id, Content_id, Stream_date, Stream_time, Stream_duration, Stream_rating) values (287, 39, 36, '10-Nov-2018', '9:15 AM', 44, 3);
insert into streams (Stream_id, Customer_id, Content_id, Stream_date, Stream_time, Stream_duration, Stream_rating) values (288, 15, 60, '19-Apr-2019', '6:31 AM', 9, 3);
insert into streams (Stream_id, Customer_id, Content_id, Stream_date, Stream_time, Stream_duration, Stream_rating) values (289, 13, 33, '04-Oct-2019', '3:07 PM', 22, 2);
insert into streams (Stream_id, Customer_id, Content_id, Stream_date, Stream_time, Stream_duration, Stream_rating) values (290, 75, 82, '28-Jul-2019', '12:51 AM', 11, 3);
insert into streams (Stream_id, Customer_id, Content_id, Stream_date, Stream_time, Stream_duration, Stream_rating) values (291, 64, 5, '18-Jun-2019', '7:27 PM', 58, 3);
insert into streams (Stream_id, Customer_id, Content_id, Stream_date, Stream_time, Stream_duration, Stream_rating) values (292, 85, 6, '14-Nov-2018', '9:22 AM', 82, 5);
insert into streams (Stream_id, Customer_id, Content_id, Stream_date, Stream_time, Stream_duration, Stream_rating) values (293, 45, 54, '07-Jul-2019', '6:34 PM', 36, 2);
insert into streams (Stream_id, Customer_id, Content_id, Stream_date, Stream_time, Stream_duration, Stream_rating) values (294, 71, 8, '28-May-2019', '7:41 AM', 16, 1);
insert into streams (Stream_id, Customer_id, Content_id, Stream_date, Stream_time, Stream_duration, Stream_rating) values (295, 17, 84, '02-Apr-2019', '11:37 PM', 51, 3);
insert into streams (Stream_id, Customer_id, Content_id, Stream_date, Stream_time, Stream_duration, Stream_rating) values (296, 31, 4, '07-Nov-2019', '12:06 AM', 86, 4);
insert into streams (Stream_id, Customer_id, Content_id, Stream_date, Stream_time, Stream_duration, Stream_rating) values (297, 77, 35, '18-Apr-2019', '8:18 AM', 74, 5);
insert into streams (Stream_id, Customer_id, Content_id, Stream_date, Stream_time, Stream_duration, Stream_rating) values (298, 82, 31, '08-Sep-2019', '9:29 AM', 74, 1);
insert into streams (Stream_id, Customer_id, Content_id, Stream_date, Stream_time, Stream_duration, Stream_rating) values (299, 39, 94, '20-Sep-2019', '2:01 AM', 78, 5);
insert into streams (Stream_id, Customer_id, Content_id, Stream_date, Stream_time, Stream_duration, Stream_rating) values (300, 55, 62, '28-Apr-2019', '3:40 AM', 59, 1);
insert into streams (Stream_id, Customer_id, Content_id, Stream_date, Stream_time, Stream_duration, Stream_rating) values (301, 42, 45, '17-Dec-2018', '1:25 PM', 36, 5);
insert into streams (Stream_id, Customer_id, Content_id, Stream_date, Stream_time, Stream_duration, Stream_rating) values (302, 6, 41, '15-Aug-2019', '4:25 AM', 15, 4);
insert into streams (Stream_id, Customer_id, Content_id, Stream_date, Stream_time, Stream_duration, Stream_rating) values (303, 61, 96, '07-Jan-2019', '6:27 PM', 96, 5);
insert into streams (Stream_id, Customer_id, Content_id, Stream_date, Stream_time, Stream_duration, Stream_rating) values (304, 62, 89, '29-Jan-2019', '12:49 PM', 2, 4);
insert into streams (Stream_id, Customer_id, Content_id, Stream_date, Stream_time, Stream_duration, Stream_rating) values (305, 55, 7, '22-Sep-2019', '10:52 AM', 88, 5);
insert into streams (Stream_id, Customer_id, Content_id, Stream_date, Stream_time, Stream_duration, Stream_rating) values (306, 50, 43, '04-Mar-2019', '6:47 AM', 11, 5);
insert into streams (Stream_id, Customer_id, Content_id, Stream_date, Stream_time, Stream_duration, Stream_rating) values (307, 74, 66, '28-Oct-2019', '3:52 AM', 85, 3);
insert into streams (Stream_id, Customer_id, Content_id, Stream_date, Stream_time, Stream_duration, Stream_rating) values (308, 47, 19, '25-Jul-2019', '1:03 AM', 12, 4);
insert into streams (Stream_id, Customer_id, Content_id, Stream_date, Stream_time, Stream_duration, Stream_rating) values (309, 72, 94, '22-May-2019', '4:58 PM', 62, 3);
insert into streams (Stream_id, Customer_id, Content_id, Stream_date, Stream_time, Stream_duration, Stream_rating) values (310, 13, 51, '09-Apr-2019', '1:15 PM', 84, 3);
insert into streams (Stream_id, Customer_id, Content_id, Stream_date, Stream_time, Stream_duration, Stream_rating) values (311, 1, 61, '20-Jun-2019', '9:41 AM', 88, 1);
insert into streams (Stream_id, Customer_id, Content_id, Stream_date, Stream_time, Stream_duration, Stream_rating) values (312, 7, 95, '27-Jan-2019', '4:34 AM', 37, 5);
insert into streams (Stream_id, Customer_id, Content_id, Stream_date, Stream_time, Stream_duration, Stream_rating) values (313, 96, 30, '03-Jan-2019', '1:46 AM', 59, 1);
insert into streams (Stream_id, Customer_id, Content_id, Stream_date, Stream_time, Stream_duration, Stream_rating) values (314, 63, 18, '08-Sep-2019', '2:38 AM', 92, 5);
insert into streams (Stream_id, Customer_id, Content_id, Stream_date, Stream_time, Stream_duration, Stream_rating) values (315, 36, 96, '30-Jul-2019', '3:54 AM', 64, 5);
insert into streams (Stream_id, Customer_id, Content_id, Stream_date, Stream_time, Stream_duration, Stream_rating) values (316, 70, 4, '08-Oct-2019', '8:50 PM', 2, 3);
insert into streams (Stream_id, Customer_id, Content_id, Stream_date, Stream_time, Stream_duration, Stream_rating) values (317, 90, 96, '27-Feb-2019', '3:48 AM', 4, 5);
insert into streams (Stream_id, Customer_id, Content_id, Stream_date, Stream_time, Stream_duration, Stream_rating) values (318, 60, 90, '03-Dec-2018', '9:49 PM', 26, 3);
insert into streams (Stream_id, Customer_id, Content_id, Stream_date, Stream_time, Stream_duration, Stream_rating) values (319, 65, 55, '23-Oct-2019', '7:35 PM', 16, 3);
insert into streams (Stream_id, Customer_id, Content_id, Stream_date, Stream_time, Stream_duration, Stream_rating) values (320, 73, 23, '25-Jan-2019', '5:34 AM', 100, 4);
insert into streams (Stream_id, Customer_id, Content_id, Stream_date, Stream_time, Stream_duration, Stream_rating) values (321, 28, 91, '29-Jun-2019', '4:35 AM', 37, 4);
insert into streams (Stream_id, Customer_id, Content_id, Stream_date, Stream_time, Stream_duration, Stream_rating) values (322, 64, 35, '03-Oct-2019', '2:24 AM', 73, 4);
insert into streams (Stream_id, Customer_id, Content_id, Stream_date, Stream_time, Stream_duration, Stream_rating) values (323, 32, 38, '27-Mar-2019', '6:24 AM', 35, 2);
insert into streams (Stream_id, Customer_id, Content_id, Stream_date, Stream_time, Stream_duration, Stream_rating) values (324, 41, 19, '18-May-2019', '7:35 PM', 34, 5);
insert into streams (Stream_id, Customer_id, Content_id, Stream_date, Stream_time, Stream_duration, Stream_rating) values (325, 91, 87, '20-Aug-2019', '7:58 AM', 50, 2);
insert into streams (Stream_id, Customer_id, Content_id, Stream_date, Stream_time, Stream_duration, Stream_rating) values (326, 6, 30, '29-Sep-2019', '12:13 PM', 13, 3);
insert into streams (Stream_id, Customer_id, Content_id, Stream_date, Stream_time, Stream_duration, Stream_rating) values (327, 20, 40, '01-Oct-2019', '1:10 AM', 60, 4);
insert into streams (Stream_id, Customer_id, Content_id, Stream_date, Stream_time, Stream_duration, Stream_rating) values (328, 73, 91, '01-Dec-2018', '3:06 PM', 38, 1);
insert into streams (Stream_id, Customer_id, Content_id, Stream_date, Stream_time, Stream_duration, Stream_rating) values (329, 76, 56, '01-Jan-2019', '2:16 PM', 18, 2);
insert into streams (Stream_id, Customer_id, Content_id, Stream_date, Stream_time, Stream_duration, Stream_rating) values (330, 71, 14, '27-Dec-2018', '3:43 AM', 95, 3);
insert into streams (Stream_id, Customer_id, Content_id, Stream_date, Stream_time, Stream_duration, Stream_rating) values (331, 33, 80, '19-Aug-2019', '11:45 PM', 65, 3);
insert into streams (Stream_id, Customer_id, Content_id, Stream_date, Stream_time, Stream_duration, Stream_rating) values (332, 69, 2, '09-May-2019', '9:39 AM', 10, 3);
insert into streams (Stream_id, Customer_id, Content_id, Stream_date, Stream_time, Stream_duration, Stream_rating) values (333, 71, 56, '29-Apr-2019', '9:45 PM', 68, 4);
insert into streams (Stream_id, Customer_id, Content_id, Stream_date, Stream_time, Stream_duration, Stream_rating) values (334, 38, 60, '08-Jan-2019', '10:00 PM', 14, 5);
insert into streams (Stream_id, Customer_id, Content_id, Stream_date, Stream_time, Stream_duration, Stream_rating) values (335, 43, 18, '24-Mar-2019', '11:16 PM', 15, 2);
insert into streams (Stream_id, Customer_id, Content_id, Stream_date, Stream_time, Stream_duration, Stream_rating) values (336, 71, 86, '15-Mar-2019', '3:48 AM', 96, 5);
insert into streams (Stream_id, Customer_id, Content_id, Stream_date, Stream_time, Stream_duration, Stream_rating) values (337, 66, 34, '05-Dec-2018', '3:22 PM', 76, 1);
insert into streams (Stream_id, Customer_id, Content_id, Stream_date, Stream_time, Stream_duration, Stream_rating) values (338, 20, 86, '15-Mar-2019', '11:43 PM', 100, 3);
insert into streams (Stream_id, Customer_id, Content_id, Stream_date, Stream_time, Stream_duration, Stream_rating) values (339, 52, 55, '05-Nov-2019', '11:57 AM', 79, 5);
insert into streams (Stream_id, Customer_id, Content_id, Stream_date, Stream_time, Stream_duration, Stream_rating) values (340, 8, 91, '27-Feb-2019', '4:19 PM', 77, 1);
insert into streams (Stream_id, Customer_id, Content_id, Stream_date, Stream_time, Stream_duration, Stream_rating) values (341, 92, 71, '18-Oct-2019', '6:28 AM', 24, 2);
insert into streams (Stream_id, Customer_id, Content_id, Stream_date, Stream_time, Stream_duration, Stream_rating) values (342, 30, 99, '21-Sep-2019', '8:31 PM', 94, 2);
insert into streams (Stream_id, Customer_id, Content_id, Stream_date, Stream_time, Stream_duration, Stream_rating) values (343, 37, 54, '14-Jan-2019', '1:32 AM', 21, 3);
insert into streams (Stream_id, Customer_id, Content_id, Stream_date, Stream_time, Stream_duration, Stream_rating) values (344, 50, 27, '17-May-2019', '5:50 PM', 22, 5);
insert into streams (Stream_id, Customer_id, Content_id, Stream_date, Stream_time, Stream_duration, Stream_rating) values (345, 88, 51, '21-Jan-2019', '6:34 AM', 77, 3);
insert into streams (Stream_id, Customer_id, Content_id, Stream_date, Stream_time, Stream_duration, Stream_rating) values (346, 20, 63, '29-Jul-2019', '2:45 AM', 17, 4);
insert into streams (Stream_id, Customer_id, Content_id, Stream_date, Stream_time, Stream_duration, Stream_rating) values (347, 94, 11, '29-Oct-2019', '12:24 PM', 66, 1);
